signify	s ɪ ɡ n ə f aɪ
teaching	t i tʃ ɪ ŋ
imprint	ɪ m p ɹ ɪ n t
captive	k æ p t ɪ v
ripple	ɹ ɪ p ə ɫ
viral	v aɪ ɹ ə ɫ
ethnicity	ɛ θ n ɪ s ɪ t i
tech	t ɛ k
slaughter	s ɫ ɔ t ɝ
intimacy	ɪ n t ə m ə s i
retire	ɹ ɪ t aɪ ɹ
hood	h ʊ d
overnight	oʊ v ɝ n aɪ t
wreck	ɹ ɛ k
critically	k ɹ ɪ t ɪ k ə ɫ i
culturally	k ʌ ɫ tʃ ɝ ə ɫ i
advancement	ə d v æ n s m ə n t
scandal	s k æ n d ə ɫ
spur	s p ɝ
paste	p eɪ s t
neat	n i t
nonlinear	n ɑ n ɫ ɪ n i ɝ
affective	ə f ɛ k t ɪ v
hurriedly	h ɝ i d ɫ i
revolt	ɹ ɪ v oʊ ɫ t
intellect	ɪ n t ə ɫ ɛ k t
dismiss	d ɪ s m ɪ s
incredibly	ɪ n k ɹ ɛ d ə b ɫ i
spoil	s p ɔɪ ɫ
perish	p ɛ ɹ ɪ ʃ
transnational	t ɹ æ n s n æ ʃ ə n ə ɫ
bronze	b ɹ ɑ n z
lust	ɫ ʌ s t
waiter	w eɪ t ɝ
audio	ɑ d i oʊ
offend	ə f ɛ n d
policeman	p ə ɫ i s m ə n
unfortunately	ə n f ɔ ɹ tʃ ə n ə t ɫ i
narrator	n ɛ ɹ eɪ t ɝ
offspring	ɔ f s p ɹ ɪ ŋ
terminology	t ɝ m ɪ n ɑ ɫ ə dʒ i
chapel	tʃ æ p ə ɫ
rationale	ɹ æ ʃ ə n æ ɫ
integer	ɪ n t ə dʒ ɝ
doll	d ɑ ɫ
pearl	p ɝ ɫ
swiftly	s w ɪ f t ɫ i
convenience	k ə n v i n j ə n s
acceleration	æ k s ɛ ɫ ɝ eɪ ʃ ə n
rim	ɹ ɪ m
refrain	ɹ ɪ f ɹ eɪ n
thrill	θ ɹ ɪ ɫ
casually	k æ ʒ ə w ə ɫ i
terrace	t ɛ ɹ ə s
cult	k ʌ ɫ t
angrily	æ ŋ ɡ ɹ ə ɫ i
microbial	m aɪ k ɹ oʊ b i ə ɫ
iteration	ɪ t ɝ eɪ ʃ ə n
torment	t ɔ ɹ m ɛ n t
mansion	m æ n ʃ ə n
spectral	s p ɛ k t ɹ ə ɫ
comedy	k ɑ m ə d i
mesh	m ɛ ʃ
plea	p ɫ i
resurrection	ɹ ɛ z ɝ ɛ k ʃ ə n
customary	k ʌ s t ə m ɛ ɹ i
custody	k ʌ s t ə d i
obesity	oʊ b i s ə t i
bowel	b aʊ ə ɫ
descriptive	d ɪ s k ɹ ɪ p t ɪ v
workforce	w ɝ k f ɔ ɹ s
scare	s k ɛ ɹ
utilization	j u t ə ɫ ə z eɪ ʃ ə n
substantive	s ʌ b s t ə n t ɪ v
detector	d ɪ t ɛ k t ɝ
unstable	ə n s t eɪ b ə ɫ
isolate	aɪ s ə ɫ eɪ t
premise	p ɹ ɛ m ɪ s
daylight	d eɪ ɫ aɪ t
sheriff	ʃ ɛ ɹ ə f
efficiently	ɪ f ɪ ʃ ə n t ɫ i
agony	æ ɡ ə n i
contemplate	k ɑ n t ə m p ɫ eɪ t
fearful	f ɪ ɹ f ə ɫ
vivo	v i v oʊ
caste	k æ s t
float	f ɫ oʊ t
relaxation	ɹ i ɫ æ k s eɪ ʃ ə n
disregard	d ɪ s ɹ ɪ ɡ ɑ ɹ d
specificity	s p ɛ s ə f ɪ s ə t i
parliament	p ɑ ɹ ɫ ə m ə n t
disc	d ɪ s k
bury	b ɛ ɹ i
notebook	n oʊ t b ʊ k
renewable	ɹ i n u ə b ə ɫ
communal	k ə m j u n ə ɫ
absurd	ə b s ɝ d
offset	ɔ f s ɛ t
prototype	p ɹ oʊ t ə t aɪ p
brake	b ɹ eɪ k
adequately	æ d ə k w ə t ɫ i
responsive	ɹ ɪ s p ɑ n s ɪ v
hastily	h eɪ s t ə ɫ i
console	k ɑ n s oʊ ɫ
album	æ ɫ b ə m
ribbon	ɹ ɪ b ə n
termination	t ɝ m ə n eɪ ʃ ə n
venue	v ɛ n j u
inappropriate	ɪ n ə p ɹ oʊ p ɹ i ɪ t
nominal	n ɑ m ə n ə ɫ
virgin	v ɝ dʒ ɪ n
viewpoint	v j u p ɔɪ n t
puff	p ʌ f
morphology	m ɔ ɹ f ɑ ɫ ə dʒ i
ambiguity	æ m b ɪ ɡ j u ə t i
inn	ɪ n
vivid	v ɪ v ə d
rally	ɹ æ ɫ i
mandatory	m æ n d ə t ɔ ɹ i
creator	k ɹ i eɪ t ɝ
promptly	p ɹ ɑ m p t ɫ i
lesion	ɫ i ʒ ə n
dictionary	d ɪ k ʃ ə n ɛ ɹ i
susceptible	s ə s ɛ p t ə b ə ɫ
indulge	ɪ n d ʌ ɫ dʒ
tiger	t aɪ ɡ ɝ
bug	b ʌ ɡ
stagger	s t æ ɡ ɝ
drawing	d ɹ ɔ ɪ ŋ
layout	ɫ eɪ aʊ t
resemblance	ɹ ɪ z ɛ m b ɫ ə n s
imitate	ɪ m ə t eɪ t
greet	ɡ ɹ i t
contraction	k ə n t ɹ æ k ʃ ə n
pragmatic	p ɹ æ ɡ m æ t ɪ k
compartment	k ə m p ɑ ɹ t m ə n t
mutually	m j u tʃ u ə ɫ i
patrol	p ə t ɹ oʊ ɫ
hierarchical	h aɪ ɹ ɑ ɹ k ə k ə ɫ
entail	ɛ n t eɪ ɫ
distinctly	d ɪ s t ɪ ŋ k t ɫ i
compute	k ə m p j u t
shortage	ʃ ɔ ɹ t ə dʒ
geographic	dʒ i ə ɡ ɹ æ f ɪ k
peasant	p ɛ z ə n t
settling	s ɛ t ə ɫ ɪ ŋ
dietary	d aɪ ə t ɛ ɹ i
focal	f oʊ k ə ɫ
balloon	b ə ɫ u n
coincidence	k oʊ ɪ n s ɪ d ə n s
refine	ɹ ə f aɪ n
modernity	m ɑ d ɝ n ə t i
inward	ɪ n w ɝ d
cab	k æ b
predicate	p ɹ ɛ d ə k eɪ t
successive	s ə k s ɛ s ɪ v
idle	aɪ d ə ɫ
countryside	k ʌ n t ɹ i s aɪ d
dash	d æ ʃ
conspiracy	k ə n s p ɪ ɹ ə s i
charter	tʃ ɑ ɹ t ɝ
smirk	s m ɝ k
soap	s oʊ p
asylum	ə s aɪ ɫ ə m
journalist	dʒ ɝ n ə ɫ ə s t
chant	tʃ æ n t
fountain	f aʊ n t ə n
replicate	ɹ ɛ p ɫ ə k eɪ t
shoe	ʃ u
riot	ɹ aɪ ə t
tread	t ɹ ɛ d
indifferent	ɪ n d ɪ f ɹ ə n t
randomly	ɹ æ n d ə m ɫ i
appropriately	ə p ɹ oʊ p ɹ i ɪ t ɫ i
unfair	ə n f ɛ ɹ
explosive	ɪ k s p ɫ oʊ s ɪ v
comprehension	k ɑ m p ɹ i h ɛ n ʃ ə n
tug	t ʌ ɡ
editorial	ɛ d ə t ɔ ɹ i ə ɫ
cerebral	s ɛ ɹ ə b ɹ ə ɫ
spike	s p aɪ k
thoughtful	θ ɔ t f ə ɫ
pixel	p ɪ k s ə ɫ
butterfly	b ʌ t ɝ f ɫ aɪ
negatively	n ɛ ɡ ə t ɪ v ɫ i
masculine	m æ s k j ə ɫ ə n
contradict	k ɑ n t ɹ ə d ɪ k t
documentary	d ɑ k j ə m ɛ n t ɝ i
embarrassment	ɪ m b ɛ ɹ ə s m ə n t
alpha	æ ɫ f ə
heroic	h ɪ ɹ oʊ ɪ k
sober	s oʊ b ɝ
plausible	p ɫ ɔ z ə b ə ɫ
haired	h ɛ ɹ d
sow	s aʊ
tan	t æ n
terrain	t ɝ eɪ n
parade	p ɝ eɪ d
composer	k ə m p oʊ z ɝ
utmost	ʌ t m oʊ s t
methodological	m ɛ θ ə d ə ɫ ɑ dʒ ɪ k ə ɫ
exempt	ɪ ɡ z ɛ m p t
mug	m ʌ ɡ
cheerful	tʃ ɪ ɹ f ə ɫ
moonlight	m u n ɫ aɪ t
betray	b ɪ t ɹ eɪ
innocence	ɪ n ə s ə n s
complementary	k ɑ m p ɫ ə m ɛ n t ɹ i
manifestation	m æ n ə f ɛ s t eɪ ʃ ə n
trash	t ɹ æ ʃ
superiority	s u p ɪ ɹ i ɔ ɹ ɪ t i
migrate	m aɪ ɡ ɹ eɪ t
inclination	ɪ n k ɫ ə n eɪ ʃ ə n
staircase	s t ɛ ɹ k eɪ s
wherein	w ɛ ɹ ɪ n
interpersonal	ɪ n t ɝ p ɝ s ə n ə ɫ
symmetry	s ɪ m ə t ɹ i
wool	w ʊ ɫ
dementia	d ɪ m ɛ n ʃ i ə
fertility	f ɝ t ɪ ɫ ə t i
trustee	t ɹ ʌ s t i
eternity	ɪ t ɝ n ə t i
grocery	ɡ ɹ oʊ s ɝ i
psychiatric	s aɪ k i æ t ɹ ɪ k
investor	ɪ n v ɛ s t ɝ
fantastic	f æ n t æ s t ɪ k
jealousy	dʒ ɛ ɫ ə s i
irrigation	ɪ ɹ ə ɡ eɪ ʃ ə n
freeze	f ɹ i z
fox	f ɑ k s
helmet	h ɛ ɫ m ə t
reading	ɹ i d ɪ ŋ
variant	v ɛ ɹ i ə n t
pharmaceutical	f ɑ ɹ m ə s u t ɪ k ə ɫ
maker	m eɪ k ɝ
theirs	ð ɛ ɹ z
depict	d ɪ p ɪ k t
tribal	t ɹ aɪ b ə ɫ
sunset	s ʌ n s ɛ t
orgasm	ɔ ɹ ɡ æ z ə m
backwards	b æ k w ɝ d z
utterance	ʌ t ɝ ə n s
cardiovascular	k ɑ ɹ d i oʊ v æ s k j ə ɫ ɝ
incentive	ɪ n s ɛ n t ɪ v
converge	k ə n v ɝ dʒ
mobilize	m oʊ b ə ɫ aɪ z
erosion	ɪ ɹ oʊ ʒ ə n
paradox	p ɛ ɹ ə d ɑ k s
substitution	s ʌ b s t ɪ t u ʃ ə n
foul	f aʊ ɫ
bargain	b ɑ ɹ ɡ ə n
humour	h j u m ɝ
unite	j u n aɪ t
vertex	v ɝ t ɛ k s
supplier	s ə p ɫ aɪ ɝ
prohibition	p ɹ oʊ ə b ɪ ʃ ə n
oppose	ə p oʊ z
practitioner	p ɹ æ k t ɪ ʃ ə n ɝ
precursor	p ɹ i k ɝ s ɝ
heel	h i ɫ
lamb	ɫ æ m
notify	n oʊ t ə f aɪ
anonymous	ə n ɑ n ə m ə s
fragile	f ɹ æ dʒ ə ɫ
delightful	d ɪ ɫ aɪ t f ə ɫ
scripture	s k ɹ ɪ p tʃ ɝ
attach	ə t æ tʃ
linen	ɫ ɪ n ə n
meter	m i t ɝ
allowance	ə ɫ aʊ ə n s
classify	k ɫ æ s ə f aɪ
alley	æ ɫ i
manufacturer	m æ n j ə f æ k tʃ ɝ ɝ
navy	n eɪ v i
invoke	ɪ n v oʊ k
reflective	ɹ ɪ f ɫ ɛ k t ɪ v
offering	ɔ f ɝ ɪ ŋ
eligible	ɛ ɫ ə dʒ ə b ə ɫ
administer	ə d m ɪ n ə s t ɝ
economically	ɛ k ə n ɑ m ɪ k ɫ i
sanction	s æ ŋ k ʃ ə n
biography	b aɪ ɑ ɡ ɹ ə f i
preacher	p ɹ i tʃ ɝ
bully	b ʊ ɫ i
celebrity	s ə ɫ ɛ b ɹ ɪ t i
literal	ɫ ɪ t ɝ ə ɫ
navigation	n æ v ə ɡ eɪ ʃ ə n
intentional	ɪ n t ɛ n ʃ ə n ə ɫ
unfamiliar	ʌ n f ə m ɪ ɫ j ɝ
rupture	ɹ ʌ p tʃ ɝ
lament	ɫ ə m ɛ n t
aboard	ə b ɔ ɹ d
massage	m ə s ɑ ʒ
distal	d ɪ s t ə ɫ
resentment	ɹ ɪ z ɛ n t m ə n t
outdoor	aʊ t d ɔ ɹ
disciple	d ɪ s aɪ p ə ɫ
cautious	k ɔ ʃ ə s
juvenile	dʒ u v ə n ə ɫ
lag	ɫ æ ɡ
beta	b eɪ t ə
fiercely	f ɪ ɹ s ɫ i
recruitment	ɹ ə k ɹ u t m ə n t
hypertension	h aɪ p ɝ t ɛ n ʃ ə n
prohibit	p ɹ oʊ h ɪ b ə t
plainly	p ɫ eɪ n ɫ i
adolescent	æ d ə ɫ ɛ s ə n t
accelerate	æ k s ɛ ɫ ɝ eɪ t
accumulate	ə k j u m j ə ɫ eɪ t
refugee	ɹ ɛ f j u dʒ i
haunt	h ɔ n t
vampire	v æ m p aɪ ɹ
dental	d ɛ n t ə ɫ
upgrade	ə p ɡ ɹ eɪ d
antenna	æ n t ɛ n ə
makeup	m eɪ k ʌ p
cruise	k ɹ u z
balcony	b æ ɫ k ə n i
perch	p ɝ tʃ
trait	t ɹ eɪ t
superficial	s u p ɝ f ɪ ʃ ə ɫ
chuckle	tʃ ʌ k ə ɫ
monastery	m ɑ n ə s t ɛ ɹ i
collector	k ə ɫ ɛ k t ɝ
jerk	dʒ ɝ k
muscular	m ʌ s k j ə ɫ ɝ
textile	t ɛ k s t aɪ ɫ
bitterly	b ɪ t ɝ ɫ i
formulate	f ɔ ɹ m j ə ɫ eɪ t
morally	m ɔ ɹ ə ɫ i
initiation	ɪ n ɪ ʃ i eɪ ʃ ə n
kernel	k ɝ n ə ɫ
globalization	ɡ ɫ oʊ b ə ɫ ɪ z eɪ ʃ ə n
brutal	b ɹ u t ə ɫ
skeleton	s k ɛ ɫ ə t ə n
rightly	ɹ aɪ t ɫ i
chiefly	tʃ i f ɫ i
antibody	æ n t ɪ b ɑ d i
transplant	t ɹ æ n s p ɫ æ n t
torch	t ɔ ɹ tʃ
mob	m ɑ b
avenue	æ v ə n u
linkage	ɫ ɪ ŋ k ə dʒ
rhetorical	ɹ ɪ t ɔ ɹ ɪ k ə ɫ
sanctuary	s æ ŋ k tʃ u ɛ ɹ i
scroll	s k ɹ oʊ ɫ
quantify	k w ɑ n t ɪ f aɪ
cushion	k ʊ ʃ ə n
mimic	m ɪ m ɪ k
elimination	ɪ ɫ ɪ m ə n eɪ ʃ ə n
consciously	k ɑ n ʃ ə s ɫ i
pavement	p eɪ v m ə n t
heterogeneous	h ɛ t ɝ ə dʒ i n j ə s
swarm	s w ɔ ɹ m
weaken	w i k ə n
ambiguous	æ m b ɪ ɡ j u ə s
vanish	v æ n ɪ ʃ
penetration	p ɛ n ə t ɹ eɪ ʃ ə n
educate	ɛ dʒ ə k eɪ t
wrath	ɹ æ θ
theft	θ ɛ f t
downtown	d aʊ n t aʊ n
supra	s u p ɹ ə
confrontation	k ɑ n f ɹ ə n t eɪ ʃ ə n
mutation	m j u t eɪ ʃ ə n
obstruction	ə b s t ɹ ʌ k ʃ ə n
wireless	w aɪ ɹ ɫ ɪ s
explode	ɪ k s p ɫ oʊ d
stray	s t ɹ eɪ
contamination	k ə n t æ m ə n eɪ ʃ ə n
migrant	m aɪ ɡ ɹ ə n t
erect	ɪ ɹ ɛ k t
cite	s aɪ t
prevalent	p ɹ ɛ v ə ɫ ə n t
visualize	v ɪ ʒ w ə ɫ aɪ z
recurrent	ɹ ɪ k ɝ ə n t
ambassador	æ m b æ s ə d ɝ
surround	s ɝ aʊ n d
scrutiny	s k ɹ u t ə n i
secretion	s ə k ɹ i ʃ ə n
quasi	k w ɑ s i
dumb	d ʌ m
rumble	ɹ ʌ m b ə ɫ
permanently	p ɝ m ə n ə n t ɫ i
retrieve	ɹ ɪ t ɹ i v
setup	s ɛ t ʌ p
dissolve	d ɪ z ɑ ɫ v
lazy	ɫ eɪ z i
catalogue	k æ t ə ɫ ɔ ɡ
supernatural	s u p ɝ n æ tʃ ɝ ə ɫ
uncommon	ə n k ɑ m ə n
scrap	s k ɹ æ p
analytic	æ n ə ɫ ɪ t ɪ k
subsection	s ʌ b s ɛ k ʃ ə n
trench	t ɹ ɛ n tʃ
transcription	t ɹ æ n s k ɹ ɪ p ʃ ə n
lattice	ɫ æ t ə s
madness	m æ d n ə s
monopoly	m ə n ɑ p ə ɫ i
uptake	ʌ p t eɪ k
prevail	p ɹ ɪ v eɪ ɫ
rental	ɹ ɛ n t ə ɫ
propagation	p ɹ ɑ p ə ɡ eɪ ʃ ə n
pat	p æ t
grim	ɡ ɹ ɪ m
wander	w ɑ n d ɝ
conductivity	k ɑ n d ʌ k t ɪ v ə t i
inquire	ɪ n k w aɪ ɹ
learner	ɫ ɝ n ɝ
decomposition	d i k ə m p oʊ z ɪ ʃ ə n
pathology	p ə θ ɑ ɫ ə dʒ i
brass	b ɹ æ s
immortal	ɪ m ɔ ɹ t ə ɫ
epic	ɛ p ɪ k
timely	t aɪ m ɫ i
procure	p ɹ oʊ k j ʊ ɹ
scaffold	s k æ f ə ɫ d
earthly	ɝ θ ɫ i
dough	d oʊ
irony	aɪ ɹ ə n i
misfortune	m ɪ s f ɔ ɹ tʃ ə n
merge	m ɝ dʒ
violently	v aɪ ə ɫ ə n t ɫ i
domination	d ɑ m ə n eɪ ʃ ə n
lounge	ɫ aʊ n dʒ
serial	s ɪ ɹ i ə ɫ
compose	k ə m p oʊ z
profitable	p ɹ ɑ f ə t ə b ə ɫ
transient	t ɹ æ n ʒ ə n t
strangely	s t ɹ eɪ n dʒ ɫ i
occupational	ɑ k j ə p eɪ ʃ ə n ə ɫ
annually	æ n j u ə ɫ i
rose	ɹ oʊ z
excellence	ɛ k s ə ɫ ə n s
procedural	p ɹ ə s i dʒ ɝ ə ɫ
indifference	ɪ n d ɪ f ɝ ə n s
thereafter	ð ɛ ɹ æ f t ɝ
tangible	t æ n dʒ ə b ə ɫ
tribunal	t ɹ ə b j u n ə ɫ
genuinely	dʒ ɛ n j ə w ə n ɫ i
lobe	ɫ oʊ b
sadly	s æ d ɫ i
chairman	tʃ ɛ ɹ m ə n
rocket	ɹ ɑ k ə t
dictate	d ɪ k t eɪ t
unaware	ʌ n ə w ɛ ɹ
suppression	s ə p ɹ ɛ ʃ ə n
triple	t ɹ ɪ p ə ɫ
neatly	n i t ɫ i
automobile	ɔ t ə m oʊ b i ɫ
homogeneous	h oʊ m ə dʒ i n i ə s
debtor	d ɛ t ɝ
irrelevant	ɪ ɹ ɛ ɫ ə v ə n t
sidewalk	s aɪ d w ɔ k
potato	p ə t eɪ t oʊ
pub	p ʌ b
pizza	p i t s ə
snack	s n æ k
shepherd	ʃ ɛ p ɝ d
credibility	k ɹ ɛ d ə b ɪ ɫ ɪ t i
dispersion	d ɪ s p ɝ ʒ ə n
nationality	n æ ʃ ə n æ ɫ ə t i
livestock	ɫ aɪ v s t ɑ k
bladder	b ɫ æ d ɝ
tattoo	t æ t u
fig	f ɪ ɡ
recollection	ɹ ɛ k ə ɫ ɛ k ʃ ə n
lime	ɫ aɪ m
invasive	ɪ n v eɪ s ɪ v
procession	p ɹ ə s ɛ ʃ ə n
harness	h ɑ ɹ n ə s
predictive	p ɹ ɪ d ɪ k t ɪ v
activism	æ k t ɪ v ɪ z ə m
cone	k oʊ n
mediate	m i d i eɪ t
eyebrow	aɪ b ɹ aʊ
simultaneous	s aɪ m ə ɫ t eɪ n i ə s
empower	ɪ m p aʊ ɝ
parliamentary	p ɑ ɹ ɫ ə m ɛ n t ɝ i
ecology	ɪ k ɑ ɫ ə dʒ i
foe	f oʊ
penny	p ɛ n i
implication	ɪ m p ɫ ə k eɪ ʃ ə n
ceramic	s ɝ æ m ɪ k
disciplinary	d ɪ s ə p ɫ ə n ɛ ɹ i
uneasy	ə n i z i
benchmark	b ɛ n tʃ m ɑ ɹ k
hardship	h ɑ ɹ d ʃ ɪ p
infectious	ɪ n f ɛ k ʃ ə s
obstacle	ɑ b s t ə k ə ɫ
conductor	k ə n d ʌ k t ɝ
pursuant	p ɝ s u ə n t
coconut	k oʊ k ə n ʌ t
sponsor	s p ɑ n s ɝ
perfume	p ɝ f j u m
inconsistent	ɪ n k ə n s ɪ s t ə n t
textual	t ɛ k s tʃ u ə ɫ
atmospheric	æ t m ə s f ɛ ɹ ɪ k
maiden	m eɪ d ə n
disturb	d ɪ s t ɝ b
adversary	æ d v ɝ s ɛ ɹ i
scrub	s k ɹ ʌ b
locus	ɫ oʊ k ə s
predictor	p ɹ ɪ d ɪ k t ɝ
deduction	d ɪ d ʌ k ʃ ə n
pasture	p æ s tʃ ɝ
exhaust	ɪ ɡ z ɔ s t
arbitration	ɑ ɹ b ɪ t ɹ eɪ ʃ ə n
capita	k æ p ɪ t ə
hind	h aɪ n d
sour	s aʊ ɝ
phosphate	f ɑ s f eɪ t
contingency	k ə n t ɪ n dʒ ə n s i
lieutenant	ɫ u t ɛ n ə n t
defy	d ɪ f aɪ
protagonist	p ɹ oʊ t æ ɡ ə n ə s t
valuation	v æ ɫ j u eɪ ʃ ə n
guitar	ɡ ɪ t ɑ ɹ
saint	s eɪ n t
interpreter	ɪ n t ɝ p ɹ ə t ɝ
melancholy	m ɛ ɫ ə n k ɑ ɫ i
syllable	s ɪ ɫ ə b ə ɫ
caress	k ɝ ɛ s
anxiously	æ ŋ k ʃ ə s ɫ i
advocacy	æ d v ə k ə s i
maneuver	m ə n u v ɝ
gleam	ɡ ɫ i m
critic	k ɹ ɪ t ɪ k
dial	d aɪ ə ɫ
whale	w eɪ ɫ
vapor	v eɪ p ɝ
persecution	p ɝ s ə k j u ʃ ə n
tutor	t u t ɝ
conquer	k ɑ ŋ k ɝ
mediation	m i d i eɪ ʃ ə n
liquor	ɫ ɪ k ɝ
collaborate	k ə ɫ æ b ɝ eɪ t
gloomy	ɡ ɫ u m i
dome	d oʊ m
digit	d ɪ dʒ ə t
extremity	ɛ k s t ɹ ɛ m ə t i
null	n ʌ ɫ
counselor	k aʊ n s ə ɫ ɝ
restless	ɹ ɛ s t ɫ ə s
taxation	t æ k s eɪ ʃ ə n
cemetery	s ɛ m ə t ɛ ɹ i
resume	ɹ ɪ z u m
risky	ɹ ɪ s k i
limp	ɫ ɪ m p
systematically	s ɪ s t ə m æ t ɪ k ɫ i
cascade	k æ s k eɪ d
supposedly	s ə p oʊ z ə d ɫ i
pipeline	p aɪ p ɫ aɪ n
slot	s ɫ ɑ t
yell	j ɛ ɫ
evoke	ɪ v oʊ k
peek	p i k
impatient	ɪ m p eɪ ʃ ə n t
blonde	b ɫ ɑ n d
umbrella	ə m b ɹ ɛ ɫ ə
ample	æ m p ə ɫ
enthusiastic	ɪ n θ u z i æ s t ɪ k
specially	s p ɛ ʃ ə ɫ i
chatter	tʃ æ t ɝ
dodge	d ɑ dʒ
outrage	aʊ t ɹ eɪ dʒ
suffice	s ə f aɪ s
vent	v ɛ n t
inverse	ɪ n v ɝ s
foremost	f ɔ ɹ m oʊ s t
litigation	ɫ ɪ t ə ɡ eɪ ʃ ə n
socioeconomic	s oʊ s i oʊ ɛ k ə n ɑ m ɪ k
incapable	ɪ n k eɪ p ə b ə ɫ
disbelief	d ɪ s b ɪ ɫ i f
potent	p oʊ t ə n t
polar	p oʊ ɫ ɝ
airway	ɛ ɹ w eɪ
contradictory	k ɑ n t ɹ ə d ɪ k t ɝ i
wedge	w ɛ dʒ
crest	k ɹ ɛ s t
descend	d ɪ s ɛ n d
macro	m æ k ɹ oʊ
biopsy	b aɪ ɑ p s i
imitation	ɪ m ə t eɪ ʃ ə n
ligand	ɫ ɪ ɡ ə n d
optic	ɑ p t ɪ k
oversee	oʊ v ɝ s i
imprisonment	ɪ m p ɹ ɪ z ə n m ə n t
certification	s ɝ t ə f ə k eɪ ʃ ə n
jungle	dʒ ʌ ŋ ɡ ə ɫ
niece	n i s
puppy	p ʌ p i
drainage	d ɹ eɪ n ə dʒ
chorus	k ɔ ɹ ə s
password	p æ s w ɝ d
battlefield	b æ t ə ɫ f i ɫ d
distract	d ɪ s t ɹ æ k t
cube	k j u b
handkerchief	h æ ŋ k ɝ tʃ ɪ f
freak	f ɹ i k
cavalry	k æ v ə ɫ ɹ i
bosom	b ʊ z ə m
decoration	d ɛ k ɝ eɪ ʃ ə n
harbour	h ɑ ɹ b ɝ
pupil	p j u p ə ɫ
exquisite	ɛ k s k w ə z ə t
photon	f oʊ t ɑ n
reconciliation	ɹ ɛ k ə n s ɪ ɫ i eɪ ʃ ə n
gambling	ɡ æ m b ə ɫ ɪ ŋ
subsidiary	s ə b s ɪ d i ɛ ɹ i
squat	s k w ɑ t
latent	ɫ eɪ t ə n t
magistrate	m æ dʒ ə s t ɹ eɪ t
comparatively	k ə m p ɛ ɹ ə t ɪ v ɫ i
mound	m aʊ n d
wildly	w aɪ ɫ d ɫ i
vicious	v ɪ ʃ ə s
turbine	t ɝ b aɪ n
embody	ɪ m b ɑ d i
precedent	p ɹ ɛ s ɪ d ə n t
villa	v ɪ ɫ ə
thief	θ i f
trader	t ɹ eɪ d ɝ
sexually	s ɛ k ʃ u ə ɫ i
broaden	b ɹ ɔ d ə n
avoidance	ə v ɔɪ d ə n s
repay	ɹ i p eɪ
embryo	ɛ m b ɹ i oʊ
notwithstanding	n ɑ t w ɪ θ s t æ n d ɪ ŋ
citation	s aɪ t eɪ ʃ ə n
notation	n oʊ t eɪ ʃ ə n
sociology	s oʊ s i ɑ ɫ ə dʒ i
advisor	æ d v aɪ z ɝ
cane	k eɪ n
fringe	f ɹ ɪ n dʒ
rot	ɹ ɑ t
meadow	m ɛ d oʊ
epidemic	ɛ p ə d ɛ m ɪ k
additive	æ d ə t ɪ v
blond	b ɫ ɑ n d
alright	ɔ ɫ ɹ aɪ t
fade	f eɪ d
groom	ɡ ɹ u m
tariff	t ɛ ɹ ə f
processor	p ɹ ɑ s ɛ s ɝ
astonishment	ə s t ɑ n ɪ ʃ m ə n t
driveway	d ɹ aɪ v w eɪ
visualization	v ɪ ʒ w ə ɫ ə z eɪ ʃ ə n
motif	m oʊ t i f
transit	t ɹ æ n z ɪ t
collectively	k ə ɫ ɛ k t ɪ v ɫ i
renewal	ɹ ɪ n u ə ɫ
dump	d ʌ m p
trifle	t ɹ aɪ f ə ɫ
distortion	d ɪ s t ɔ ɹ ʃ ə n
shudder	ʃ ʌ d ɝ
parcel	p ɑ ɹ s ə ɫ
kit	k ɪ t
vault	v ɔ ɫ t
dagger	d æ ɡ ɝ
dynasty	d aɪ n ə s t i
drone	d ɹ oʊ n
metallic	m ə t æ ɫ ɪ k
frost	f ɹ ɔ s t
outlook	aʊ t ɫ ʊ k
tab	t æ b
proclaim	p ɹ oʊ k ɫ eɪ m
directive	d ɝ ɛ k t ɪ v
tier	t i ɹ
readiness	ɹ ɛ d i n ə s
transcend	t ɹ æ n s ɛ n d
respectable	ɹ ɪ s p ɛ k t ə b ə ɫ
artillery	ɑ ɹ t ɪ ɫ ɝ i
cumulative	k j u m j ə ɫ ə t ɪ v
radar	ɹ eɪ d ɑ ɹ
rationality	ɹ æ ʃ ə n æ ɫ ɪ t i
tenderness	t ɛ n d ɝ n ə s
sprinkle	s p ɹ ɪ ŋ k ə ɫ
accuse	ə k j u z
constructive	k ə n s t ɹ ʌ k t ɪ v
remarkably	ɹ ɪ m ɑ ɹ k ə b ɫ i
monarch	m ɑ n ɑ ɹ k
innate	ɪ n eɪ t
thankful	θ æ ŋ k f ə ɫ
verification	v ɛ ɹ ə f ə k eɪ ʃ ə n
buck	b ʌ k
memorial	m ə m ɔ ɹ i ə ɫ
optimize	ɑ p t ə m aɪ z
thyroid	θ aɪ ɹ ɔɪ d
medial	m i d i ə ɫ
apt	æ p t
auction	ɑ k ʃ ə n
erase	ɪ ɹ eɪ s
hereafter	h ɪ ɹ æ f t ɝ
helicopter	h ɛ ɫ ɪ k ɑ p t ɝ
sue	s u
duke	d u k
proximal	p ɹ ɑ k s ə m ə ɫ
honesty	ɑ n ə s t i
hospitality	h ɑ s p ə t æ ɫ ə t i
furnish	f ɝ n ɪ ʃ
lineage	ɫ ɪ n i ə dʒ
spider	s p aɪ d ɝ
glue	ɡ ɫ u
adviser	æ d v aɪ z ɝ
rocky	ɹ ɑ k i
realism	ɹ i ə ɫ ɪ z m
insect	ɪ n s ɛ k t
clergy	k ɫ ɝ dʒ i
tilt	t ɪ ɫ t
subjectivity	s ə b dʒ ɛ k t ɪ v ɪ t i
blessing	b ɫ ɛ s ɪ ŋ
whatsoever	w ʌ t s oʊ ɛ v ɝ
gravel	ɡ ɹ æ v ə ɫ
harassment	h ɝ æ s m ə n t
ultrasound	ʌ ɫ t ɹ ə s aʊ n d
nutrient	n u t ɹ i ə n t
ditch	d ɪ tʃ
forensic	f ɝ ɛ n s ɪ k
marvel	m ɑ ɹ v ə ɫ
finely	f aɪ n ɫ i
racist	ɹ eɪ s ɪ s t
inherently	ɪ n h ɪ ɹ ə n t ɫ i
anatomy	ə n æ t ə m i
canoe	k ə n u
arrogant	ɛ ɹ ə ɡ ə n t
deaf	d ɛ f
segmentation	s ɛ ɡ m ə n t eɪ ʃ ə n
cradle	k ɹ eɪ d ə ɫ
foreigner	f ɔ ɹ ə n ɝ
aspire	ə s p aɪ ɹ
stationary	s t eɪ ʃ ə n ɛ ɹ i
hatch	h æ tʃ
exterior	ɪ k s t ɪ ɹ i ɝ
census	s ɛ n s ə s
hitherto	h ɪ ð ɝ t u
abstraction	æ b s t ɹ æ k ʃ ə n
altitude	æ ɫ t ə t u d
verdict	v ɝ d ɪ k t
connectivity	k ə n ɛ k t ɪ v ɪ t i
upwards	ʌ p w ɝ d z
tenure	t ɛ n j ɝ
bye	b aɪ
condemn	k ə n d ɛ m
insane	ɪ n s eɪ n
eagle	i ɡ ə ɫ
nutritional	n u t ɹ ɪ ʃ ə n ə ɫ
statistically	s t ə t ɪ s t ɪ k ə ɫ i
scout	s k aʊ t
persistence	p ɝ s ɪ s t ə n s
rip	ɹ ɪ p
salute	s ə ɫ u t
wildlife	w aɪ ɫ d ɫ aɪ f
giggle	ɡ ɪ ɡ ə ɫ
merger	m ɝ dʒ ɝ
cruelty	k ɹ u ɫ t i
scary	s k ɛ ɹ i
blur	b ɫ ɝ
pedagogy	p ɛ d ə ɡ oʊ dʒ i
anguish	æ ŋ ɡ w ɪ ʃ
trivial	t ɹ ɪ v i ə ɫ
unprecedented	ə n p ɹ ɛ s ɪ d ɛ n t ɪ d
feather	f ɛ ð ɝ
candy	k æ n d i
arguably	ɑ ɹ ɡ j u ə b ɫ i
tremble	t ɹ ɛ m b ə ɫ
bust	b ʌ s t
smoothly	s m u ð ɫ i
quo	k w oʊ
gym	dʒ ɪ m
vigorous	v ɪ ɡ ɝ ə s
prosecutor	p ɹ ɑ s ɪ k j u t ɝ
antioxidant	æ n t i ɑ k s ə d ə n t
specialist	s p ɛ ʃ ə ɫ ə s t
curiously	k j ʊ ɹ i ə s ɫ i
continuum	k ə n t ɪ n j u ə m
incorporation	ɪ n k ɔ ɹ p ɝ eɪ ʃ ə n
cathedral	k ə θ i d ɹ ə ɫ
melody	m ɛ ɫ ə d i
cannon	k æ n ə n
symptom	s ɪ m p t ə m
devote	d ɪ v oʊ t
seasonal	s i z ə n ə ɫ
hopefully	h oʊ p f ə ɫ i
adjective	æ dʒ ɪ k t ɪ v
sur	s ɝ
humanitarian	h j u m æ n ə t ɛ ɹ i ə n
dissertation	d ɪ s ɝ t eɪ ʃ ə n
yeast	j i s t
duct	d ʌ k t
lantern	ɫ æ n t ɝ n
locality	ɫ oʊ k æ ɫ ə t i
farewell	f ɛ ɹ w ɛ ɫ
coronary	k ɔ ɹ ə n ɛ ɹ i
terribly	t ɛ ɹ ə b ɫ i
exemption	ɪ ɡ z ɛ m p ʃ ə n
stubborn	s t ʌ b ɝ n
spectacular	s p ɛ k t æ k j ə ɫ ɝ
sailing	s eɪ ɫ ɪ ŋ
understanding	ʌ n d ɝ s t æ n d ɪ ŋ
toll	t oʊ ɫ
antiquity	æ n t ɪ k w ə t i
niche	n ɪ tʃ
sage	s eɪ dʒ
invariably	ɪ n v ɛ ɹ i ə b ɫ i
polynomial	p ɑ ɫ i n oʊ m i ə ɫ
ventilation	v ɛ n t ə ɫ eɪ ʃ ə n
wretched	ɹ ɛ tʃ ɪ d
electrolyte	ɪ ɫ ɛ k t ɹ ɑ ɫ aɪ t
landmark	ɫ æ n d m ɑ ɹ k
disappearance	d ɪ s ə p ɪ ɹ ə n s
aisle	aɪ ɫ
cervical	s ɝ v ə k ə ɫ
terminate	t ɝ m ə n eɪ t
prose	p ɹ oʊ z
dialect	d aɪ ə ɫ ɛ k t
soften	s ɑ f ə n
aqueous	eɪ k w i ə s
ya	j ɑ
undergraduate	ʌ n d ɝ ɡ ɹ æ dʒ ə w ə t
practise	p ɹ æ k t ɪ s
cheat	tʃ i t
noisy	n ɔɪ z i
doubtless	d aʊ t ɫ ə s
angular	æ ŋ ɡ j ə ɫ ɝ
lure	ɫ ʊ ɹ
deploy	d ɪ p ɫ ɔɪ
humility	h j u m ɪ ɫ ɪ t i
restrain	ɹ i s t ɹ eɪ n
pronoun	p ɹ oʊ n aʊ n
ventricular	v ɛ n t ɹ ɪ k j u ɫ ɝ
instruct	ɪ n s t ɹ ʌ k t
dairy	d ɛ ɹ i
beautifully	b j u t ə f ɫ i
contextual	k ɑ n t ɛ k s tʃ u ə ɫ
debris	d ə b ɹ i
precipitation	p ɹ ɪ s ɪ p ɪ t eɪ ʃ ə n
proudly	p ɹ aʊ d ɫ i
soluble	s ɑ ɫ j ə b ə ɫ
headline	h ɛ d ɫ aɪ n
portray	p ɔ ɹ t ɹ eɪ
siege	s i dʒ
tribute	t ɹ ɪ b j u t
crisp	k ɹ ɪ s p
depiction	d ɪ p ɪ k ʃ ə n
comb	k oʊ m
vicinity	v ə s ɪ n ə t i
haste	h eɪ s t
tendon	t ɛ n d ə n
invade	ɪ n v eɪ d
segregation	s ɛ ɡ ɹ ə ɡ eɪ ʃ ə n
fictional	f ɪ k ʃ ə n ə ɫ
crust	k ɹ ʌ s t
doubtful	d aʊ t f ə ɫ
dissolution	d ɪ s ə ɫ u ʃ ə n
undo	ə n d u
fixation	f ɪ k s eɪ ʃ ə n
shove	ʃ ʌ v
assemble	ə s ɛ m b ə ɫ
villager	v ɪ ɫ ɪ dʒ ɝ
abdomen	æ b d oʊ m ə n
cigar	s ɪ ɡ ɑ ɹ
shiny	ʃ aɪ n i
roam	ɹ oʊ m
coffin	k ɔ f ɪ n
insertion	ɪ n s ɝ ʃ ə n
banner	b æ n ɝ
hymn	h ɪ m
lengthy	ɫ ɛ ŋ θ i
overtake	oʊ v ɝ t eɪ k
confer	k ə n f ɝ
ambulance	æ m b j ə ɫ ə n s
treatise	t ɹ i t ə s
claimant	k ɫ eɪ m ə n t
overly	oʊ v ɝ ɫ i
sergeant	s ɑ ɹ dʒ ə n t
collateral	k ə ɫ æ t ɝ ə ɫ
socialism	s oʊ ʃ ə ɫ ɪ z ə m
vaguely	v eɪ ɡ ɫ i
pork	p ɔ ɹ k
speculate	s p ɛ k j ə ɫ eɪ t
chemotherapy	k i m oʊ θ ɛ ɹ ə p i
golf	ɡ ɑ ɫ f
dissent	d ɪ s ɛ n t
swap	s w ɑ p
masculinity	m æ s k j ə ɫ ɪ n ə t i
volatile	v ɑ ɫ ə t ə ɫ
yoga	j oʊ ɡ ə
spirituality	s p ɪ ɹ ɪ tʃ u æ ɫ ə t i
openness	oʊ p ə n n ə s
precipitate	p ɹ ɪ s ɪ p ɪ t eɪ t
fetal	f i t ə ɫ
converse	k ɑ n v ɝ s
analogous	ə n æ ɫ ə ɡ ə s
memoir	m ɛ m w ɑ ɹ
functionality	f ʌ ŋ k ʃ ə n æ ɫ ɪ t i
authenticity	ɔ θ ə n t ɪ s ɪ t i
withstand	w ɪ θ s t æ n d
visibility	v ɪ z ə b ɪ ɫ ɪ t i
imbalance	ɪ m b æ ɫ ə n s
toil	t ɔɪ ɫ
mould	m oʊ ɫ d
metaphysical	m ɛ t ə f ɪ z ɪ k ə ɫ
bicycle	b aɪ s ɪ k ə ɫ
nasty	n æ s t i
hearted	h ɑ ɹ t ə d
deliberation	d ɪ ɫ ɪ b ɝ eɪ ʃ ə n
propagate	p ɹ ɑ p ə ɡ eɪ t
orbital	ɔ ɹ b ə t ə ɫ
blog	b ɫ ɔ ɡ
accidentally	æ k s ə d ɛ n t ə ɫ i
deceive	d ɪ s i v
plunge	p ɫ ʌ n dʒ
ensemble	ɑ n s ɑ m b ə ɫ
aftermath	æ f t ɝ m æ θ
taxpayer	t æ k s p eɪ ɝ
grandson	ɡ ɹ æ n d s ʌ n
catheter	k æ θ ə t ɝ
mute	m j u t
intestinal	ɪ n t ɛ s t ə n ə ɫ
booth	b u θ
baptism	b æ p t ɪ z ə m
plaster	p ɫ æ s t ɝ
relay	ɹ i ɫ eɪ
runner	ɹ ʌ n ɝ
deception	d ɪ s ɛ p ʃ ə n
clone	k ɫ oʊ n
clearance	k ɫ ɪ ɹ ə n s
rattle	ɹ æ t ə ɫ
senator	s ɛ n ə t ɝ
faintly	f eɪ n t ɫ i
mindset	m aɪ n d s ɛ t
detention	d ɪ t ɛ n ʃ ə n
polarization	p oʊ ɫ ɝ ə z eɪ ʃ ə n
bureaucracy	b j ʊ ɹ ɑ k ɹ ə s i
furnace	f ɝ n ə s
chloride	k ɫ ɔ ɹ aɪ d
fireplace	f aɪ ɝ p ɫ eɪ s
rag	ɹ æ ɡ
reflex	ɹ i f ɫ ɛ k s
fortress	f ɔ ɹ t ɹ ə s
urgency	ɝ dʒ ə n s i
homeless	h oʊ m ɫ ə s
gum	ɡ ʌ m
vinegar	v ɪ n ə ɡ ɝ
activist	æ k t ə v ə s t
translator	t ɹ æ n s ɫ eɪ t ɝ
chop	tʃ ɑ p
loneliness	ɫ oʊ n ɫ i n ə s
kinetic	k ə n ɛ t ɪ k
bandage	b æ n d ɪ dʒ
holistic	h oʊ ɫ ɪ s t ɪ k
folly	f ɑ ɫ i
creek	k ɹ i k
globally	ɡ ɫ oʊ b ə ɫ i
routinely	ɹ u t i n ɫ i
photographer	f ə t ɑ ɡ ɹ ə f ɝ
keeper	k i p ɝ
coherence	k oʊ h ɪ ɹ ə n s
velvet	v ɛ ɫ v ə t
shrine	ʃ ɹ aɪ n
omission	oʊ m ɪ ʃ ə n
apprehension	æ p ɹ ɪ h ɛ n ʃ ə n
exhaustion	ɪ ɡ z ɔ s tʃ ə n
await	ə w eɪ t
scrape	s k ɹ eɪ p
exceedingly	ɪ k s i d ɪ ŋ ɫ i
geometric	dʒ i ə m ɛ t ɹ ɪ k
fiery	f aɪ ɝ i
slim	s ɫ ɪ m
standpoint	s t æ n d p ɔɪ n t
ontology	ɑ n t ɑ ɫ ə dʒ i
rigorous	ɹ ɪ ɡ ɝ ə s
familiarity	f ə m ɪ ɫ j ɛ ɹ ə t i
fairness	f ɛ ɹ n ə s
heed	h i d
talented	t æ ɫ ə n t ɪ d
agitation	æ dʒ ə t eɪ ʃ ə n
ah	ɑ
mat	m æ t
presume	p ɹ ɪ z u m
appoint	ə p ɔɪ n t
pillar	p ɪ ɫ ɝ
designation	d ɛ z ə ɡ n eɪ ʃ ə n
privately	p ɹ aɪ v ə t ɫ i
formidable	f ɔ ɹ m ə d ə b ə ɫ
lofty	ɫ ɔ f t i
sunny	s ʌ n i
grill	ɡ ɹ ɪ ɫ
exotic	ɪ ɡ z ɑ t ɪ k
soybean	s ɔɪ b i n
auto	ɔ t oʊ
slit	s ɫ ɪ t
nervously	n ɝ v ə s ɫ i
huh	h ʌ
discriminate	d ɪ s k ɹ ɪ m ə n eɪ t
meanwhile	m i n w aɪ ɫ
anniversary	æ n ə v ɝ s ɝ i
impart	ɪ m p ɑ ɹ t
poll	p oʊ ɫ
implicitly	ɪ m p ɫ ɪ s ə t ɫ i
id	ɪ d
banana	b ə n æ n ə
whence	w ɛ n s
commissioner	k ə m ɪ ʃ ə n ɝ
resonate	ɹ ɛ z ə n eɪ t
thirst	θ ɝ s t
reversal	ɹ ɪ v ɝ s ə ɫ
acoustic	ə k u s t ɪ k
expressive	ɪ k s p ɹ ɛ s ɪ v
benign	b ɪ n aɪ n
proton	p ɹ oʊ t ɑ n
ere	ɛ ɹ
marrow	m ɛ ɹ oʊ
canon	k æ n ə n
postwar	p oʊ s t w ɔ ɹ
profoundly	p ɹ oʊ f aʊ n d ɫ i
nasal	n eɪ z ə ɫ
coup	k u
interruption	ɪ n t ɝ ʌ p ʃ ə n
delegation	d ɛ ɫ ə ɡ eɪ ʃ ə n
academy	ə k æ d ə m i
