recreational	ɹ ɛ k ɹ i eɪ ʃ ə n ə ɫ
mercury	m ɝ k j ɝ i
deepen	d i p ə n
dichotomy	d aɪ k ɑ t ə m i
pleasantly	p ɫ ɛ z ə n t ɫ i
zoom	z u m
tenderly	t ɛ n d ɝ ɫ i
unconditional	ʌ n k ə n d ɪ ʃ ə n ə ɫ
crater	k ɹ eɪ t ɝ
judiciary	dʒ u d ɪ ʃ i ɛ ɹ i
saliva	s ə ɫ aɪ v ə
pear	p ɛ ɹ
vocation	v oʊ k eɪ ʃ ə n
epithelium	ɛ p ɪ θ i ɫ j ə m
fluorescent	f ɫ ʊ ɹ ɛ s ə n t
oracle	ɔ ɹ ə k ə ɫ
hoarse	h ɔ ɹ s
distort	d ɪ s t ɔ ɹ t
dopamine	d ɑ p ə m aɪ n
pane	p eɪ n
taxable	t æ k s ə b ə ɫ
vertically	v ɝ t ɪ k ɫ i
oddly	ɑ d ɫ i
chalk	tʃ ɑ k
plump	p ɫ ʌ m p
proverb	p ɹ ɑ v ɝ b
catastrophic	k æ t ə s t ɹ ɑ f ɪ k
ammonia	ə m oʊ n j ə
radioactive	ɹ eɪ d i oʊ æ k t ɪ v
inject	ɪ n dʒ ɛ k t
peninsula	p ə n ɪ n s ə ɫ ə
quench	k w ɛ n tʃ
analogue	æ n ə ɫ ɔ ɡ
enjoyable	ɛ n dʒ ɔɪ ə b ə ɫ
tack	t æ k
starvation	s t ɑ ɹ v eɪ ʃ ə n
befall	b ɪ f ɔ ɫ
tactic	t æ k t ɪ k
underestimate	ʌ n d ɝ ɛ s t ə m eɪ t
selectivity	s ɪ ɫ ɛ k t ɪ v ə t i
subsystem	s ʌ b s ɪ s t ə m
trustworthy	t ɹ ʌ s t w ɝ ð i
shipment	ʃ ɪ p m ə n t
papa	p ɑ p ʌ
whisky	w ɪ s k i
ceremonial	s ɛ ɹ ə m oʊ n i ə ɫ
dude	d u d
whiteness	w aɪ t n ə s
impetus	ɪ m p ə t ə s
concession	k ə n s ɛ ʃ ə n
affliction	ə f ɫ ɪ k ʃ ə n
bunk	b ʌ ŋ k
plough	p ɫ aʊ
gig	ɡ ɪ ɡ
unfinished	ə n f ɪ n ɪ ʃ t
guerrilla	ɡ ɝ ɪ ɫ ə
stanza	s t æ n z ə
guild	ɡ ɪ ɫ d
unnoticed	ə n n oʊ t ɪ s t
milestone	m aɪ ɫ s t oʊ n
endpoint	ɛ n d p ɔɪ n t
patriotism	p eɪ t ɹ i ə t ɪ z ə m
conducive	k ə n d u s ɪ v
dew	d u
purposely	p ɝ p ə s ɫ i
nucleotide	n u k ɫ i ə t aɪ d
dialectic	d aɪ ə ɫ ɛ k t ɪ k
moth	m ɔ θ
mercenary	m ɝ s ə n ɛ ɹ i
mol	m ɔ ɫ
deletion	d ɪ ɫ i ʃ ə n
stunt	s t ʌ n t
diffraction	d ɪ f ɹ æ k ʃ ə n
eagerness	i ɡ ɝ n ə s
saloon	s ə ɫ u n
earl	ɝ ɫ
maturation	m æ tʃ ɝ eɪ ʃ ə n
remotely	ɹ i m oʊ t ɫ i
ordeal	ɔ ɹ d i ɫ
chilly	tʃ ɪ ɫ i
adhesive	æ d h i s ɪ v
caravan	k æ ɹ ə v æ n
equate	ɪ k w eɪ t
reactivity	ɹ i æ k t ɪ v ə t i
suspend	s ə s p ɛ n d
yo	j oʊ
heterosexual	h ɛ t ɝ oʊ s ɛ k ʃ ə w ə ɫ
morale	m ɝ æ ɫ
prep	p ɹ ɛ p
inhibitory	ɪ n h ɪ b ə t ɔ ɹ i
alight	ə ɫ aɪ t
pluck	p ɫ ʌ k
shrill	ʃ ɹ ɪ ɫ
benevolent	b ə n ɛ v ə ɫ ə n t
marijuana	m ɛ ɹ ə w ɑ n ə
confine	k ə n f aɪ n
evacuation	ɪ v æ k j ə w eɪ ʃ ə n
grind	ɡ ɹ aɪ n d
redundant	ɹ ɪ d ʌ n d ə n t
paralysis	p ɝ æ ɫ ə s ə s
manure	m ə n ʊ ɹ
faction	f æ k ʃ ə n
lizard	ɫ ɪ z ɝ d
opening	oʊ p ə n ɪ ŋ
maple	m eɪ p ə ɫ
rainy	ɹ eɪ n i
digestive	d aɪ dʒ ɛ s t ɪ v
regulator	ɹ ɛ ɡ j ə ɫ eɪ t ɝ
nuanced	n u ɑ n s t
acetate	æ s ə t eɪ t
torrent	t ɔ ɹ ə n t
tentative	t ɛ n t ə t ɪ v
brook	b ɹ ʊ k
ta	t ɑ
rosy	ɹ oʊ z i
ovary	oʊ v ɝ i
trout	t ɹ aʊ t
preferably	p ɹ ɛ f ɝ ə b ɫ i
uniformity	j u n ə f ɔ ɹ m ə t i
artifact	ɑ ɹ t ə f æ k t
hearing	h i ɹ ɪ ŋ
dubious	d u b i ə s
hydrolysis	h aɪ d ɹ ɑ ɫ ə s ə s
feudal	f j u d ə ɫ
attest	ə t ɛ s t
diner	d aɪ n ɝ
anomaly	ə n ɑ m ə ɫ i
converter	k ə n v ɝ t ɝ
perennial	p ɝ ɛ n i ə ɫ
hostess	h oʊ s t ə s
adrenal	ə d ɹ i n ə ɫ
receptive	ɹ ɪ s ɛ p t ɪ v
multicultural	m ʌ ɫ t i k ʌ ɫ tʃ ɝ ə ɫ
ethic	ɛ θ ɪ k
cosmos	k ɑ z m oʊ s
chronological	k ɹ ɑ n ə ɫ ɑ dʒ ɪ k ə ɫ
cardboard	k ɑ ɹ d b ɔ ɹ d
suffrage	s ʌ f ɹ ɪ dʒ
grit	ɡ ɹ ɪ t
fortnight	f ɔ ɹ t n aɪ t
rein	ɹ eɪ n
hasten	h eɪ s ə n
multilateral	m ʌ ɫ t ɪ ɫ æ t ɝ ə ɫ
exemplary	ɪ ɡ z ɛ m p ɫ ɝ i
clumsy	k ɫ ʌ m z i
adrenaline	ə d ɹ ɛ n ə ɫ ə n
chestnut	tʃ ɛ s n ʌ t
piss	p ɪ s
narration	n ɛ ɹ eɪ ʃ ə n
drastically	d ɹ æ s t ɪ k ɫ i
autoimmune	ɔ t ɔɪ m j u n
tedious	t i d i ə s
totality	t oʊ t æ ɫ ə t i
traction	t ɹ æ k ʃ ə n
supplementary	s ʌ p ɫ ə m ɛ n t ɝ i
emulate	ɛ m j ə ɫ eɪ t
anaerobic	æ n ɝ oʊ b ɪ k
donation	d oʊ n eɪ ʃ ə n
educator	ɛ dʒ ə k eɪ t ɝ
courageous	k ɝ eɪ dʒ ə s
constable	k ɑ n s t ə b ə ɫ
decorate	d ɛ k ɝ eɪ t
diaspora	d aɪ æ s p ɝ ə
joyous	dʒ ɔɪ ə s
evaporation	ɪ v æ p ɝ eɪ ʃ ə n
climatic	k ɫ aɪ m æ t ɪ k
majestic	m ə dʒ ɛ s t ɪ k
survivor	s ɝ v aɪ v ɝ
mildly	m aɪ ɫ d ɫ i
iterative	ɪ t ɝ eɪ t ɪ v
surfactant	s ɝ f æ k t ə n t
throughput	θ ɹ u p ʊ t
ante	æ n t i
vividly	v ɪ v ə d ɫ i
compilation	k ɑ m p ə ɫ eɪ ʃ ə n
disperse	d ɪ s p ɝ s
remnant	ɹ ɛ m n ə n t
yoke	j oʊ k
willow	w ɪ ɫ oʊ
infiltration	ɪ n f ɪ ɫ t ɹ eɪ ʃ ə n
infarction	ɪ n f ɑ ɹ k ʃ ə n
transistor	t ɹ æ n z ɪ s t ɝ
diversification	d aɪ v ɝ s ə f ə k eɪ ʃ ə n
psalm	s ɑ ɫ m
whore	h ɔ ɹ
fret	f ɹ ɛ t
extravagant	ɛ k s t ɹ æ v ə ɡ ə n t
vortex	v ɔ ɹ t ɛ k s
eccentric	ɪ k s ɛ n t ɹ ɪ k
corrective	k ɝ ɛ k t ɪ v
salvage	s æ ɫ v ə dʒ
veto	v i t oʊ
deference	d ɛ f ɝ ə n s
edible	ɛ d ə b ə ɫ
payoff	p eɪ ɔ f
paw	p ɔ
bruise	b ɹ u z
motivational	m oʊ t ə v eɪ ʃ ə n ə ɫ
examiner	ɪ ɡ z æ m ə n ɝ
mantra	m æ n t ɹ ə
apoptosis	æ p ɔ p t oʊ s ɪ z
peacefully	p i s f ə ɫ i
neonatal	n i oʊ n eɪ t ə ɫ
satin	s æ t ə n
planetary	p ɫ æ n ə t ɛ ɹ i
rubbish	ɹ ʌ b ɪ ʃ
distributor	d ɪ s t ɹ ɪ b j ə t ɝ
suicidal	s u ə s aɪ d ə ɫ
baron	b æ ɹ ə n
robotic	ɹ oʊ b ɑ t ɪ k
cookie	k ʊ k i
enrollment	ɛ n ɹ oʊ ɫ m ə n t
palpable	p æ ɫ p ə b ə ɫ
ardent	ɑ ɹ d ə n t
humankind	h j u m ə n k aɪ n d
voter	v oʊ t ɝ
grape	ɡ ɹ eɪ p
indictment	ɪ n d aɪ t m ə n t
widen	w aɪ d ə n
untouched	ə n t ʌ tʃ t
isotope	aɪ s ə t oʊ p
burger	b ɝ ɡ ɝ
cosmopolitan	k ɑ z m ə p ɑ ɫ ə t ə n
unavoidable	ʌ n ə v ɔɪ d ə b ə ɫ
aviation	eɪ v i eɪ ʃ ə n
pluralism	p ɫ ʊ ɹ ə ɫ ɪ z ə m
impair	ɪ m p ɛ ɹ
symbolism	s ɪ m b ə ɫ ɪ z ə m
flutter	f ɫ ʌ t ɝ
ominous	ɑ m ə n ə s
adversity	æ d v ɝ s ɪ t i
preschool	p ɹ i s k u ɫ
bloc	b ɫ ɑ k
censorship	s ɛ n s ɝ ʃ ɪ p
revel	ɹ ɛ v ə ɫ
wrestling	ɹ ɛ s ɫ ɪ ŋ
pituitary	p ə t u ə t ɛ ɹ i
reunion	ɹ i u n j ə n
synthesize	s ɪ n θ ə s aɪ z
cessation	s ɛ s eɪ ʃ ə n
freshwater	f ɹ ɛ ʃ w ɔ t ɝ
wont	w oʊ n t
inflow	ɪ n f ɫ oʊ
decorative	d ɛ k ɹ ə t ɪ v
thoracic	θ ɔ ɹ æ s ɪ k
malice	m æ ɫ ə s
inseparable	ɪ n s ɛ p ɝ ə b ə ɫ
hesitant	h ɛ z ɪ t ə n t
kinetics	k ə n ɛ t ɪ k s
maxim	m æ k s ə m
stoop	s t u p
predicament	p ɹ ɪ d ɪ k ə m ə n t
henceforth	h ɛ n s f ɔ ɹ θ
puncture	p ʌ ŋ k tʃ ɝ
completeness	k ə m p ɫ i t n ə s
marvellous	m ɑ ɹ v ə ɫ ə s
externally	ɪ k s t ɝ n ə ɫ i
fable	f eɪ b ə ɫ
stainless	s t eɪ n ɫ ə s
hi	h aɪ
patio	p æ t i oʊ
coexist	k oʊ ə ɡ z ɪ s t
agonist	æ ɡ ə n ɪ s t
cruiser	k ɹ u z ɝ
inaccurate	ɪ n æ k j ɝ ə t
strategically	s t ɹ ə t i dʒ ɪ k ɫ i
discredit	d ɪ s k ɹ ɛ d ə t
dungeon	d ʌ n dʒ ə n
counteract	k aʊ n t ɝ æ k t
shadowy	ʃ æ d oʊ i
addict	ə d ɪ k t
symbolize	s ɪ m b ə ɫ aɪ z
nationwide	n eɪ ʃ ə n w aɪ d
concubine	k ɑ n k j ə b aɪ n
metastatic	m ɛ t ə s t æ t ɪ k
font	f ɑ n t
synonymous	s ə n ɑ n ə m ə s
augment	ɔ ɡ m ɛ n t
observational	ɑ b z ɝ v eɪ ʃ ə n ə ɫ
leisurely	ɫ i z ɝ ɫ i
ordinarily	ɔ ɹ d ə n ɛ ɹ ə ɫ i
razor	ɹ eɪ z ɝ
cocoa	k oʊ k oʊ
sacrament	s æ k ɹ ə m ə n t
aerobic	ɛ ɹ oʊ b ɪ k
parity	p ɛ ɹ ə t i
cherish	tʃ ɛ ɹ ɪ ʃ
reportedly	ɹ ɪ p ɔ ɹ t ə d ɫ i
trot	t ɹ ɑ t
whereabouts	w ɛ ɹ ə b aʊ t s
whine	w aɪ n
rabbi	ɹ æ b aɪ
circulate	s ɝ k j ə ɫ eɪ t
tiptoe	t ɪ p t oʊ
monastic	m ə n æ s t ɪ k
uniqueness	j u n i k n ə s
metaphorical	m ɛ t ə f ɔ ɹ ɪ k ə ɫ
provisional	p ɹ ə v ɪ ʒ ə n ə ɫ
photographic	f oʊ t ə ɡ ɹ æ f ɪ k
solicitor	s ə ɫ ɪ s ə t ɝ
leukemia	ɫ u k i m i ə
wrench	ɹ ɛ n tʃ
pelvis	p ɛ ɫ v ə s
filler	f ɪ ɫ ɝ
nuisance	n u s ə n s
dissatisfy	d ɪ s æ t ə s f aɪ
knob	n ɑ b
bondage	b ɑ n d ɪ dʒ
disparate	d ɪ s p ɝ ɪ t
intelligible	ɪ n t ɛ ɫ ə dʒ ə b ə ɫ
loom	ɫ u m
humorous	h j u m ɝ ə s
compile	k ə m p aɪ ɫ
stately	s t eɪ t ɫ i
exhale	ɛ k s h eɪ ɫ
vagina	v ə dʒ aɪ n ə
degeneration	d ɪ dʒ ɛ n ɝ eɪ ʃ ə n
polity	p ɑ ɫ ə t i
curly	k ɝ ɫ i
alkaline	æ ɫ k ə ɫ aɪ n
grandeur	ɡ ɹ æ n d u ɹ
lance	ɫ æ n s
shotgun	ʃ ɑ t ɡ ʌ n
tingle	t ɪ ŋ ɡ ə ɫ
nationally	n æ ʃ ə n ə ɫ i
timeline	t aɪ m ɫ aɪ n
obese	oʊ b i s
monograph	m ɑ n ə ɡ ɹ æ f
needy	n i d i
recoil	ɹ i k ɔɪ ɫ
orthogonal	ɔ ɹ θ ɔ ɡ ə n ə ɫ
startup	s t ɑ ɹ t ʌ p
fullness	f ʊ ɫ n ə s
propriety	p ɹ ə p ɹ aɪ ə t i
reflexive	ɹ ə f ɫ ɛ k s ɪ v
incarceration	ɪ n k ɑ ɹ s ɝ eɪ ʃ ə n
indefinite	ɪ n d ɛ f ə n ə t
bleak	b ɫ i k
securely	s ɪ k j ʊ ɹ ɫ i
commemorate	k ə m ɛ m ɝ eɪ t
influx	ɪ n f ɫ ʌ k s
closeness	k ɫ oʊ s n ɪ s
motto	m ɑ t oʊ
coating	k oʊ t ɪ ŋ
ozone	oʊ z oʊ n
redistribution	ɹ i d ɪ s t ɹ ə b j u ʃ ə n
enthusiastically	ɪ n θ u z i æ s t ɪ k ɫ i
somatic	s oʊ m ɑ t ɪ k
prominently	p ɹ ɑ m ə n ə n t ɫ i
prosecute	p ɹ ɑ s ə k j u t
psychoanalysis	s aɪ k oʊ ə n æ ɫ ə s ə s
ventral	v ɛ n t ɹ ə ɫ
salinity	s ə ɫ ɪ n ə t i
memo	m ɛ m oʊ
plurality	p ɫ ɝ æ ɫ ɪ t i
workout	w ɝ k aʊ t
anthropological	æ n θ ɹ ə p ə ɫ ɑ dʒ ə k ə ɫ
extinct	ɪ k s t ɪ ŋ k t
nigh	n aɪ
ingenious	ɪ n dʒ i n j ə s
jelly	dʒ ɛ ɫ i
infringe	ɪ n f ɹ ɪ n dʒ
pudding	p ʊ d ɪ ŋ
carbohydrate	k ɑ ɹ b oʊ h aɪ d ɹ eɪ t
supervisory	s u p ɝ v aɪ z ɝ i
insanity	ɪ n s æ n ə t i
erroneous	ɛ ɹ oʊ n i ə s
commencement	k ə m ɛ n s m ə n t
demeanor	d ɪ m i n ɝ
nourish	n ɝ ɪ ʃ
objectively	ɑ b dʒ ɛ k t ɪ v ɫ i
sprout	s p ɹ aʊ t
rouse	ɹ aʊ s
environmentally	ɪ n v aɪ ɹ ə n m ɛ n t ə ɫ i
wanna	w ɑ n ə
oblique	ə b ɫ i k
chemist	k ɛ m ɪ s t
taboo	t æ b u
trance	t ɹ æ n s
deduct	d ɪ d ʌ k t
inadvertently	ɪ n ə d v ɝ t ə n t ɫ i
beak	b i k
commute	k ə m j u t
lifeless	ɫ aɪ f ɫ ə s
prolong	p ɹ ə ɫ ɔ ŋ
delve	d ɛ ɫ v
pavilion	p ə v ɪ ɫ j ə n
curry	k ʌ ɹ i
specialization	s p ɛ ʃ ə ɫ ə z eɪ ʃ ə n
cuisine	k w ɪ z i n
reorganization	ɹ i ɔ ɹ ɡ ə n ə z eɪ ʃ ə n
shawl	ʃ ɔ ɫ
bonnet	b ɑ n ə t
convoy	k ɑ n v ɔɪ
deterministic	d ɪ t ɝ m ə n ɪ s t ɪ k
spotlight	s p ɑ t ɫ aɪ t
thinker	θ ɪ ŋ k ɝ
sewage	s u ə dʒ
transmitter	t ɹ æ n s m ɪ t ɝ
congestion	k ə n dʒ ɛ s tʃ ə n
drastic	d ɹ æ s t ɪ k
immoral	ɪ m ɔ ɹ ə ɫ
intrigue	ɪ n t ɹ i ɡ
haven	h eɪ v ə n
insulation	ɪ n s ə ɫ eɪ ʃ ə n
incidental	ɪ n s ɪ d ɛ n t ə ɫ
kindergarten	k ɪ n d ɝ ɡ ɑ ɹ t ə n
comrade	k ɑ m ɹ æ d
animate	æ n ə m ə t
sinner	s ɪ n ɝ
transcendental	t ɹ æ n s ə n d ɛ n t ə ɫ
trek	t ɹ ɛ k
scanner	s k æ n ɝ
transcendent	t ɹ æ n s ɛ n d ə n t
fray	f ɹ eɪ
serene	s ɝ i n
hometown	h oʊ m t aʊ n
austerity	ɔ s t ɛ ɹ ɪ t i
justly	dʒ ʌ s t ɫ i
retailer	ɹ i t eɪ ɫ ɝ
latency	ɫ eɪ t ə n s i
fabulous	f æ b j ə ɫ ə s
transporter	t ɹ æ n s p ɔ ɹ t ɝ
jug	dʒ ʌ ɡ
negate	n ɪ ɡ eɪ t
quantification	k w ɑ n t ɪ f ə k eɪ ʃ ə n
enlargement	ɪ n ɫ ɑ ɹ dʒ m ə n t
obsolete	ɑ b s ə ɫ i t
experimentally	ɪ k s p ɛ ɹ ə m ɛ n t ə ɫ i
inefficient	ɪ n ɪ f ɪ ʃ ə n t
mucosa	m j u k oʊ s ə
affiliate	ə f ɪ ɫ i eɪ t
instantaneous	ɪ n s t ə n t æ n i ə s
pawn	p ɔ n
jurisprudence	dʒ ʊ ɹ ə s p ɹ u d ə n s
interdependence	ɪ n t ɝ d ə p ɛ n d ə n s
seafood	s i f u d
ancestry	æ n s ɛ s t ɹ i
leftover	ɫ ɛ f t oʊ v ɝ
brutality	b ɹ u t æ ɫ ə t i
motherhood	m ʌ ð ɝ h ʊ d
casino	k ə s i n oʊ
trophy	t ɹ oʊ f i
ostensibly	ɑ s t ɛ n s ə b ɫ i
guideline	ɡ aɪ d ɫ aɪ n
ant	æ n t
tacit	t æ s ɪ t
outdoors	aʊ t d ɔ ɹ z
urgently	ɝ dʒ ə n t ɫ i
poker	p oʊ k ɝ
exponent	ɛ k s p oʊ n ə n t
sweetly	s w i t ɫ i
sanitation	s æ n ə t eɪ ʃ ə n
academia	æ k ə d i m i ə
unreliable	ʌ n ɹ ɪ ɫ aɪ ə b ə ɫ
porcelain	p ɔ ɹ s ə ɫ ə n
bakery	b eɪ k ɝ i
dogma	d ɑ ɡ m ə
guise	ɡ aɪ z
neutralize	n u t ɹ ə ɫ aɪ z
emblem	ɛ m b ɫ ə m
thither	ð ɪ θ ɝ
unmarried	ə n m ɛ ɹ i d
choke	tʃ oʊ k
falsehood	f æ ɫ s h ʊ d
funnel	f ʌ n ə ɫ
existent	ɛ ɡ z ɪ s t ə n t
culprit	k ʌ ɫ p ɹ ɪ t
generously	dʒ ɛ n ɝ ə s ɫ i
expulsion	ɪ k s p ʌ ɫ ʃ ə n
eloquent	ɛ ɫ ə k w ə n t
vacancy	v eɪ k ə n s i
canine	k eɪ n aɪ n
uterus	j u t ɝ ə s
arid	æ ɹ ə d
pedal	p ɛ d ə ɫ
gin	dʒ ɪ n
unmistakable	ʌ n m ɪ s t eɪ k ə b ə ɫ
brood	b ɹ u d
conjure	k ɑ n dʒ ɝ
boxer	b ɑ k s ɝ
facet	f æ s ə t
sac	s æ k
creamy	k ɹ i m i
whim	w ɪ m
syringe	s ɝ ɪ n dʒ
dispel	d ɪ s p ɛ ɫ
genealogy	dʒ i n i ɑ ɫ ə dʒ i
midwife	m ɪ d w aɪ f
atrophy	æ t ɹ ə f i
paradoxical	p ɛ ɹ ə d ɑ k s ɪ k ə ɫ
concomitant	k ɑ n k ɑ m ə t ə n t
bartender	b ɑ ɹ t ɛ n d ɝ
longevity	ɫ ɔ n dʒ ɛ v ə t i
opium	oʊ p i ə m
nostalgia	n ɔ s t æ ɫ dʒ ə
loot	ɫ u t
mushroom	m ʌ ʃ ɹ u m
temperate	t ɛ m p ɹ ə t
crusade	k ɹ u s eɪ d
terrific	t ɝ ɪ f ɪ k
disapproval	d ɪ s ə p ɹ u v ə ɫ
redress	ɹ ɪ d ɹ ɛ s
influenza	ɪ n f ɫ u ɛ n z ə
slay	s ɫ eɪ
reshape	ɹ i ʃ eɪ p
gratification	ɡ ɹ æ t ə f ə k eɪ ʃ ə n
quaint	k w eɪ n t
idol	aɪ d ə ɫ
homage	ɑ m ə dʒ
bulge	b ʌ ɫ dʒ
modesty	m ɑ d ə s t i
donate	d oʊ n eɪ t
anyhow	ɛ n i h aʊ
ferocious	f ɝ oʊ ʃ ə s
lame	ɫ eɪ m
watershed	w ɔ t ɝ ʃ ɛ d
dimly	d ɪ m ɫ i
responsiveness	ɹ ɪ s p ɑ n s ɪ v n ə s
reset	ɹ i s ɛ t
shrewd	ʃ ɹ u d
richly	ɹ ɪ tʃ ɫ i
curling	k ɝ ɫ ɪ ŋ
mechanically	m ə k æ n ɪ k ɫ i
caregiver	k ɛ ɹ ɡ ɪ v ɝ
shameful	ʃ eɪ m f ə ɫ
configure	k ə n f ɪ ɡ j ɝ
floral	f ɫ ɔ ɹ ə ɫ
connective	k ə n ɛ k t ɪ v
burrow	b ɝ oʊ
hourly	aʊ ɹ ɫ i
exploratory	ɪ k s p ɫ ɔ ɹ ə t ɔ ɹ i
roommate	ɹ u m eɪ t
merciful	m ɝ s ɪ f ə ɫ
taxonomy	t æ k s ɔ n ə m i
consul	k ɑ n s ə ɫ
conjugate	k ɑ n dʒ ə ɡ eɪ t
snapshot	s n æ p ʃ ɑ t
transfusion	t ɹ æ n s f j u ʒ ə n
flask	f ɫ æ s k
paternal	p ə t ɝ n ə ɫ
tuition	t j u ɪ ʃ ə n
advisable	ə d v aɪ z ə b ə ɫ
intolerable	ɪ n t ɑ ɫ ɝ ə b ə ɫ
ravine	ɹ ə v i n
idiom	ɪ d i ə m
eco	i k oʊ
apartheid	ə p ɑ ɹ t aɪ t
lunar	ɫ u n ɝ
luminous	ɫ u m ə n ə s
issuance	ɪ ʃ u ə n s
acknowledgement	æ k n ɑ ɫ ɪ dʒ m ə n t
tandem	t æ n d ə m
ledger	ɫ ɛ dʒ ɝ
daytime	d eɪ t aɪ m
wickedness	w ɪ k ə d n ə s
info	ɪ n f oʊ
hockey	h ɑ k i
heathen	h i ð ə n
freezer	f ɹ i z ɝ
forefront	f ɔ ɹ f ɹ ʌ n t
unpaid	ə n p eɪ d
tunic	t u n ɪ k
irreversible	ɪ ɹ ɪ v ɝ s ə b ə ɫ
hinge	h ɪ n dʒ
endowment	ɛ n d aʊ m ə n t
dedicate	d ɛ d ə k eɪ t
revolve	ɹ i v ɑ ɫ v
desktop	d ɛ s k t ɑ p
aneurysm	æ n j ʊ ɹ ɪ z ə m
yonder	j ɑ n d ɝ
competitor	k ə m p ɛ t ə t ɝ
witchcraft	w ɪ tʃ k ɹ æ f t
rum	ɹ ʌ m
inexpensive	ɪ n ɪ k s p ɛ n s ɪ v
inactive	ɪ n æ k t ɪ v
probabilistic	p ɹ ɑ b ə b ɪ ɫ ɪ s t ə k
lava	ɫ ɑ v ə
macroeconomic	m æ k ɹ oʊ ɛ k ə n ɑ m ɪ k
encode	ɛ n k oʊ d
sternly	s t ɝ n ɫ i
lush	ɫ ʌ ʃ
tout	t aʊ t
keenly	k i n ɫ i
debut	d eɪ b j u
dentist	d ɛ n t ə s t
wig	w ɪ ɡ
dwelling	d w ɛ ɫ ɪ ŋ
fathom	f æ ð ə m
amplify	æ m p ɫ ə f aɪ
postulate	p ɑ s tʃ ə ɫ eɪ t
melanoma	m ɛ ɫ ə n oʊ m ə
compulsion	k ə m p ʌ ɫ ʃ ə n
puddle	p ʌ d ə ɫ
sunglasses	s ʌ n ɡ ɫ æ s ɪ z
deliverance	d ɪ ɫ ɪ v ɝ ə n s
bravery	b ɹ eɪ v ɝ i
semiotic	s ɛ m i ɑ t ɪ k
decipher	d ɪ s aɪ f ɝ
secondly	s ɛ k ə n d ɫ i
polymerization	p ɑ ɫ ɪ m ɝ ə z eɪ ʃ ə n
excessively	ɪ k s ɛ s ɪ v ɫ i
instructive	ɪ n s t ɹ ʌ k t ɪ v
ironically	aɪ ɹ ɑ n ɪ k ɫ i
tractor	t ɹ æ k t ɝ
cathode	k æ θ oʊ d
gorge	ɡ ɔ ɹ dʒ
contentious	k ə n t ɛ n ʃ ə s
fortunately	f ɔ ɹ tʃ ə n ə t ɫ i
satire	s æ t aɪ ɝ
blueprint	b ɫ u p ɹ ɪ n t
rebellious	ɹ ɪ b ɛ ɫ j ə s
herb	ɝ b
saucepan	s ɔ s p æ n
grassland	ɡ ɹ æ s ɫ æ n d
municipality	m j u n ɪ s ə p æ ɫ ə t i
twinkle	t w ɪ ŋ k ə ɫ
undue	ə n d u
wrongly	ɹ ɔ ŋ ɫ i
motel	m oʊ t ɛ ɫ
muse	m j u z
trio	t ɹ i oʊ
forcibly	f ɔ ɹ s ə b ɫ i
grimace	ɡ ɹ ɪ m ə s
conserve	k ə n s ɝ v
intrude	ɪ n t ɹ u d
inception	ɪ n s ɛ p ʃ ə n
emigration	ɛ m ə ɡ ɹ eɪ ʃ ə n
blindly	b ɫ aɪ n d ɫ i
roughness	ɹ ʌ f n ə s
dearly	d ɪ ɹ ɫ i
sclerosis	s k ɫ ɝ oʊ s ə s
lordship	ɫ ɔ ɹ d ʃ ɪ p
caffeine	k æ f i n
monumental	m ɑ n j ə m ɛ n t ə ɫ
unaffected	ʌ n ə f ɛ k t ɪ d
amiable	eɪ m i ə b ə ɫ
anode	æ n oʊ d
wretch	ɹ ɛ tʃ
displace	d ɪ s p ɫ eɪ s
gale	ɡ eɪ ɫ
powerfully	p aʊ ɝ f ɫ i
authorship	ɔ θ ɝ ʃ ɪ p
symmetrical	s ə m ɛ t ɹ ɪ k ə ɫ
perfusion	p ɝ f j u z ə n
parsley	p ɑ ɹ s ɫ i
runway	ɹ ʌ n w eɪ
pathogenic	p æ θ ə dʒ ɛ n ɪ k
spasm	s p æ z ə m
abolish	ə b ɑ ɫ ɪ ʃ
entanglement	ɛ n t æ ŋ ɡ ə ɫ m ə n t
homemade	h oʊ m m eɪ d
intercultural	ɪ n t ɝ k ʌ ɫ tʃ ɝ ə ɫ
mythical	m ɪ θ ə k ə ɫ
amplifier	æ m p ɫ ə f aɪ ɝ
watery	w ɔ t ɝ i
turf	t ɝ f
stronghold	s t ɹ ɔ ŋ h oʊ ɫ d
plum	p ɫ ʌ m
underway	ʌ n d ɝ w eɪ
psychosis	s aɪ k oʊ s ə s
genus	dʒ i n ə s
tempo	t ɛ m p oʊ
recount	ɹ ɪ k aʊ n t
displeasure	d ɪ s p ɫ ɛ ʒ ɝ
occlusion	ə k ɫ u ʒ ə n
graphical	ɡ ɹ æ f ɪ k ə ɫ
bracket	b ɹ æ k ɪ t
whimper	w ɪ m p ɝ
ablation	ʌ b ɫ eɪ ʃ ə n
nexus	n ɛ k s ə s
illustrative	ɪ ɫ ʌ s t ɹ ə t ɪ v
farmhouse	f ɑ ɹ m h aʊ s
retaliation	ɹ i t æ ɫ i eɪ ʃ ə n
pathogenesis	p æ θ ə dʒ ɛ n ə s ɪ s
waveform	w eɪ v f ɔ ɹ m
boredom	b ɔ ɹ d ə m
algebraic	æ ɫ dʒ ə b ɹ eɪ ɪ k
censor	s ɛ n s ɝ
coma	k oʊ m ə
economical	ɛ k ə n ɑ m ɪ k ə ɫ
vantage	v æ n t ə dʒ
denominator	d ɪ n ɑ m ə n eɪ t ɝ
trespass	t ɹ ɛ s p æ s
ischemic	ɪ s k ɛ m ɪ k
ebb	ɛ b
impulsive	ɪ m p ʌ ɫ s ɪ v
hyper	h aɪ p ɝ
homosexuality	h oʊ m oʊ s ɛ k ʃ u æ ɫ ə t i
potency	p oʊ t ə n s i
topography	t ə p ɑ ɡ ɹ ə f i
cater	k eɪ t ɝ
ration	ɹ æ ʃ ə n
incite	ɪ n s aɪ t
waiver	w eɪ v ɝ
exaggeration	ɪ ɡ z æ dʒ ɝ eɪ ʃ ə n
cot	k ɑ t
investigative	ɪ n v ɛ s t ə ɡ eɪ t ɪ v
quadratic	k w ɑ d ɹ ɑ t ɪ k
condensation	k ɑ n d ə n s eɪ ʃ ə n
covariance	k oʊ v ɑ ɹ i ə n s
testosterone	t ɛ s t ɑ s t ɝ oʊ n
helplessness	h ɛ ɫ p ɫ ə s n ə s
unauthorized	ə n ɔ θ ɝ aɪ z d
dialectical	d aɪ ə ɫ ɛ k t ɪ k ə ɫ
breaker	b ɹ eɪ k ɝ
eligibility	ɛ ɫ ɪ dʒ ə b ɪ ɫ ɪ t i
immature	ɪ m ə t j ʊ ɹ
conceivable	k ə n s i v ə b ə ɫ
suspense	s ə s p ɛ n s
coordinator	k oʊ ɔ ɹ d ə n eɪ t ɝ
economist	ɪ k ɑ n ə m ɪ s t
parole	p ɝ oʊ ɫ
incline	ɪ n k ɫ aɪ n
savor	s eɪ v ɝ
situate	s ɪ tʃ u eɪ t
carelessly	k ɛ ɹ ɫ ə s ɫ i
bearing	b ɛ ɹ ɪ ŋ
decimal	d ɛ s ə m ə ɫ
pronunciation	p ɹ oʊ n ʌ n s i eɪ ʃ ə n
primacy	p ɹ aɪ m ə s i
unrealistic	ə n ɹ i ɫ ɪ s t ɪ k
reprint	ɹ i p ɹ ɪ n t
walnut	w ɔ ɫ n ʌ t
thaw	θ ɔ
shooter	ʃ u t ɝ
frighten	f ɹ aɪ t ə n
reddish	ɹ ɛ d ɪ ʃ
tonic	t ɑ n ɪ k
ransom	ɹ æ n s ə m
reassurance	ɹ i ə ʃ ʊ ɹ ə n s
disseminate	d ɪ s ɛ m ə n eɪ t
conveniently	k ə n v i n j ə n t ɫ i
zoo	z u
doorstep	d ɔ ɹ s t ɛ p
cucumber	k j u k ə m b ɝ
coercive	k oʊ ɝ s ɪ v
mischievous	m ɪ s tʃ ə v ə s
agrarian	ə ɡ ɹ ɛ ɹ i ə n
anion	æ n aɪ ɔ n
settler	s ɛ t ə ɫ ɝ
forfeit	f ɔ ɹ f ɪ t
marvelous	m ɑ ɹ v ə ɫ ə s
disobey	d ɪ s ə b eɪ
hustle	h ʌ s ə ɫ
grassroots	ɡ ɹ æ s ɹ u t s
leash	ɫ i ʃ
anesthetic	æ n ə s θ ɛ t ɪ k
extraordinarily	ɛ k s t ɹ ɔ ɹ d ə n ɛ ɹ ə ɫ i
northward	n ɔ ɹ θ w ɝ d
punitive	p j u n ə t ɪ v
boycott	b ɔɪ k ɑ t
championship	tʃ æ m p i ə n ʃ ɪ p
palliative	p æ ɫ i ə t ɪ v
hoof	h u f
sabotage	s æ b ə t ɑ ʒ
registry	ɹ ɛ dʒ ɪ s t ɹ i
persevere	p ɝ s ə v ɪ ɹ
endocrine	ɛ n d oʊ k ɹ aɪ n
charismatic	k ɛ ɹ ɪ z m æ t ɪ k
taper	t eɪ p ɝ
vegetarian	v ɛ dʒ ə t ɛ ɹ i ə n
parody	p ɛ ɹ ə d i
disparity	d ɪ s p ɛ ɹ ə t i
manly	m æ n ɫ i
tubular	t u b j ə ɫ ɝ
generalize	dʒ ɛ n ɝ ə ɫ aɪ z
grotesque	ɡ ɹ oʊ t ɛ s k
disagreeable	d ɪ s ə ɡ ɹ i ə b ə ɫ
eastward	i s t w ɝ d
awfully	ɑ f ɫ i
observance	ə b z ɝ v ə n s
litter	ɫ ɪ t ɝ
situational	s ɪ tʃ u eɪ ʃ ə n ə ɫ
outflow	aʊ t f ɫ oʊ
fissure	f ɪ ʃ ɝ
hairy	h ɛ ɹ i
follower	f ɑ ɫ oʊ ɝ
determinant	d ɪ t ɝ m ə n ə n t
antagonism	æ n t æ ɡ ə n ɪ z ə m
intrinsically	ɪ n t ɹ ɪ n s ɪ k ə ɫ i
quadrant	k w ɑ d ɹ ə n t
overweight	oʊ v ɝ w eɪ t
bounty	b aʊ n t i
tar	t ɑ ɹ
flora	f ɫ ɔ ɹ ə
gamble	ɡ æ m b ə ɫ
treacherous	t ɹ ɛ tʃ ɝ ə s
phenomenal	f ə n ɑ m ə n ə ɫ
fowl	f aʊ ɫ
materialism	m ə t ɪ ɹ i ə ɫ ɪ z ə m
profess	p ɹ ə f ɛ s
parametric	p ɛ ɹ ə m ɛ t ɹ ɪ k
illustrious	ɪ ɫ ʌ s t ɹ i ə s
caller	k ɔ ɫ ɝ
herbal	ɝ b ə ɫ
gathering	ɡ æ ð ɝ ɪ ŋ
primal	p ɹ aɪ m ə ɫ
archaeology	ɑ ɹ k i ɑ ɫ ə dʒ i
denounce	d ɪ n aʊ n s
conceit	k ə n s i t
lottery	ɫ ɑ t ɝ i
unification	j u n ə f ə k eɪ ʃ ə n
skillet	s k ɪ ɫ ə t
dean	d i n
purify	p j ʊ ɹ ə f aɪ
lash	ɫ æ ʃ
amorphous	ə m ɔ ɹ f ə s
aback	ə b æ k
dreary	d ɹ ɪ ɹ i
bourgeoisie	b ʊ ɹ ʒ w ɑ z i
clown	k ɫ aʊ n
beverage	b ɛ v ɝ ɪ dʒ
opaque	oʊ p eɪ k
soak	s oʊ k
polarity	p oʊ ɫ ɛ ɹ ə t i
heresy	h ɛ ɹ ə s i
professionally	p ɹ ə f ɛ ʃ ə n ə ɫ i
standardization	s t æ n d ɝ d ɪ z eɪ ʃ ə n
vintage	v ɪ n t ɪ dʒ
atypical	eɪ t ɪ p ɪ k ə ɫ
nobleman	n oʊ b ə ɫ m ə n
impediment	ɪ m p ɛ d ə m ə n t
cranial	k ɹ eɪ n j ə ɫ
brink	b ɹ ɪ ŋ k
sling	s ɫ ɪ ŋ
shunt	ʃ ʌ n t
disobedience	d ɪ s ə b i d i ə n s
circumference	s ɝ k ʌ m f ɹ ə n s
hurdle	h ɝ d ə ɫ
hallmark	h ɑ ɫ m ɑ ɹ k
precondition	p ɹ i k ə n d ɪ ʃ ə n
swirl	s w ɝ ɫ
indignant	ɪ n d ɪ ɡ n ə n t
normalization	n ɔ ɹ m ə ɫ ɪ z eɪ ʃ ə n
emit	ɪ m ɪ t
bustle	b ʌ s ə ɫ
compost	k ɑ m p oʊ s t
fixture	f ɪ k s tʃ ɝ
pretext	p ɹ i t ɛ k s t
discreet	d ɪ s k ɹ i t
flop	f ɫ ɑ p
murderous	m ɝ d ɝ ə s
indefinitely	ɪ n d ɛ f ə n ə t ɫ i
unintended	ʌ n ɪ n t ɛ n d ɪ d
prudence	p ɹ u d ə n s
daze	d eɪ z
refractory	ɹ ə f ɹ æ k t ɝ i
visionary	v ɪ ʒ ə n ɛ ɹ i
privatization	p ɹ aɪ v ə t ə z eɪ ʃ ə n
amber	æ m b ɝ
rev	ɹ ɛ v
ascribe	ə s k ɹ aɪ b
vie	v aɪ
redirect	ɹ i d ɝ ɛ k t
moderation	m ɑ d ɝ eɪ ʃ ə n
emphatically	ɛ m f æ t ɪ k ɫ i
harp	h ɑ ɹ p
honourable	ɑ n ɝ ə b ə ɫ
emerald	ɛ m ɹ ə ɫ d
lumbar	ɫ ʌ m b ɑ ɹ
correctness	k ɝ ɛ k t n ə s
trough	t ɹ ɔ f
sarcasm	s ɑ ɹ k æ z ə m
downwards	d aʊ n w ɝ d z
faulty	f ɔ ɫ t i
brag	b ɹ æ ɡ
provocative	p ɹ oʊ v ɑ k ə t ɪ v
shilling	ʃ ɪ ɫ ɪ ŋ
cynical	s ɪ n ɪ k ə ɫ
agile	æ dʒ ə ɫ
astronomer	ə s t ɹ ɑ n ə m ɝ
involuntarily	ɪ n v oʊ ɫ ʌ n t ɝ ɪ ɫ i
deflect	d ɪ f ɫ ɛ k t
insecure	ɪ n s ə k j ɝ
clutter	k ɫ ʌ t ɝ
politeness	p ə ɫ aɪ t n ə s
predator	p ɹ ɛ d ə t ɝ
unavailable	ʌ n ə v eɪ ɫ ə b ə ɫ
penal	p i n ə ɫ
howling	h aʊ ɫ ɪ ŋ
hither	h ɪ ð ɝ
emulsion	ɪ m ʌ ɫ ʃ ə n
absurdity	ə b s ɝ d ə t i
cripple	k ɹ ɪ p ə ɫ
adultery	ə d ʌ ɫ t ɝ i
concise	k ə n s aɪ s
gentleness	dʒ ɛ n t ə ɫ n ə s
containment	k ə n t eɪ n m ə n t
utilitarian	j u t ɪ ɫ ə t ɛ ɹ i ə n
suction	s ʌ k ʃ ə n
transformer	t ɹ æ n s f ɔ ɹ m ɝ
lowly	ɫ oʊ ɫ i
elegance	ɛ ɫ ə ɡ ə n s
jolly	dʒ ɑ ɫ i
methanol	m ɛ θ ə n ɑ ɫ
recreate	ɹ ɛ k ɹ i eɪ t
prerogative	p ɹ ɪ ɹ ɑ ɡ ə t ɪ v
chunk	tʃ ʌ ŋ k
fascist	f æ ʃ ɪ s t
resolute	ɹ ɛ z ə ɫ u t
halo	h eɪ ɫ oʊ
acutely	ə k j u t ɫ i
clove	k ɫ oʊ v
quiz	k w ɪ z
newsletter	n u z ɫ ɛ t ɝ
monomer	m ɑ n ə m ɝ
reliably	ɹ ɪ ɫ aɪ ə b ɫ i
eloquence	ɛ ɫ ə k w ə n s
whichever	w ɪ tʃ ɛ v ɝ
companionship	k ə m p æ n j ə n ʃ ɪ p
horizontally	h ɔ ɹ ɪ z ɑ n t ə ɫ i
refill	ɹ i f ɪ ɫ
naughty	n ɔ t i
vial	v aɪ ə ɫ
brisk	b ɹ ɪ s k
censure	s ɛ n ʃ ɝ
palate	p æ ɫ ə t
egalitarian	ɪ ɡ æ ɫ ə t ɛ ɹ i ə n
carotid	k ɝ ɑ t ɪ d
unsafe	ə n s eɪ f
categorization	k æ t ə ɡ ɝ ɪ z eɪ ʃ ə n
diode	d aɪ oʊ d
contributor	k ə n t ɹ ɪ b j ə t ɝ
conduit	k ɑ n d u ɪ t
probation	p ɹ oʊ b eɪ ʃ ə n
selfishness	s ɛ ɫ f ɪ ʃ n ə s
titanium	t aɪ t eɪ n i ə m
fraught	f ɹ ɔ t
tapestry	t æ p ə s t ɹ i
inwardly	ɪ n w ɝ d ɫ i
brittle	b ɹ ɪ t ə ɫ
additionally	ə d ɪ ʃ ə n ʌ ɫ i
rigidity	ɹ ɪ dʒ ɪ d ə t i
nozzle	n ɑ z ə ɫ
adorable	ə d ɔ ɹ ə b ə ɫ
renovation	ɹ ɛ n ə v eɪ ʃ ə n
skim	s k ɪ m
enormously	ɪ n ɔ ɹ m ə s ɫ i
dorm	d ɔ ɹ m
rite	ɹ aɪ t
interstate	ɪ n t ɝ s t eɪ t
exogenous	ɛ k s oʊ dʒ ə n ə s
repel	ɹ ɪ p ɛ ɫ
rotational	ɹ oʊ t eɪ ʃ ə n ə ɫ
dangerously	d eɪ n dʒ ɝ ə s ɫ i
primordial	p ɹ ɪ m ɔ ɹ d i ə ɫ
thrombosis	θ ɹ ɑ m b oʊ s ə s
cartridge	k ɑ ɹ t ɹ ə dʒ
pulpit	p ʊ ɫ p ɪ t
clerical	k ɫ ɛ ɹ ə k ə ɫ
horrid	h ɔ ɹ ə d
selectively	s ə ɫ ɛ k t ɪ v ɫ i
attenuation	ə t ɛ n j u eɪ ʃ ə n
uterine	j u t ɝ ə n
juncture	dʒ ʌ ŋ k tʃ ɝ
harshly	h ɑ ɹ ʃ ɫ i
ballad	b æ ɫ ə d
exacerbate	ɪ ɡ z æ s ɝ b eɪ t
generative	dʒ ɛ n ɝ ə t ɪ v
binder	b aɪ n d ɝ
nip	n ɪ p
lovingly	ɫ ʌ v ɪ ŋ ɫ i
humane	h j u m eɪ n
perpetrator	p ɝ p ə t ɹ eɪ t ɝ
offline	ɔ f ɫ aɪ n
precedence	p ɹ ɛ s ə d ə n s
bibliography	b ɪ b ɫ i ɑ ɡ ɹ ə f i
inert	ɪ n ɝ t
rake	ɹ eɪ k
sibling	s ɪ b ɫ ɪ ŋ
uranium	j ɝ eɪ n i ə m
heroin	h ɛ ɹ oʊ ə n
conqueror	k ɑ ŋ k ɝ ɝ
draught	d ɹ æ f t
dissociation	d ɪ s oʊ s i eɪ ʃ ə n
lotus	ɫ oʊ t ə s
redundancy	ɹ ɪ d ʌ n d ə n s i
