systematic	s ɪ s t ə m æ t ɪ k
province	p ɹ ɑ v ə n s
methodology	m ɛ θ ə d ɑ ɫ ə dʒ i
acquire	ə k w aɪ ɝ
summary	s ʌ m ɝ i
psychology	s aɪ k ɑ ɫ ə dʒ i
disappear	d ɪ s ə p ɪ ɹ
mutual	m j u tʃ u ə ɫ
reserve	ɹ ɪ z ɝ v
factory	f æ k t ɝ i
instantly	ɪ n s t ə n t ɫ i
partnership	p ɑ ɹ t n ɝ ʃ ɪ p
carriage	k æ ɹ ɪ dʒ
discrimination	d ɪ s k ɹ ɪ m ə n eɪ ʃ ə n
fiction	f ɪ k ʃ ə n
accompany	ə k ʌ m p ə n i
ongoing	ɑ n ɡ oʊ ɪ ŋ
acquisition	æ k w ə z ɪ ʃ ə n
shelter	ʃ ɛ ɫ t ɝ
radiation	ɹ eɪ d i eɪ ʃ ə n
newly	n u ɫ i
worthy	w ɝ ð i
pound	p aʊ n d
accordance	ə k ɔ ɹ d ə n s
synthesis	s ɪ n θ ə s ə s
remarkable	ɹ ɪ m ɑ ɹ k ə b ə ɫ
utility	j u t ɪ ɫ ə t i
county	k aʊ n t i
clause	k ɫ ɔ z
succeed	s ə k s i d
historian	h ɪ s t ɔ ɹ i ə n
format	f ɔ ɹ m æ t
detect	d ɪ t ɛ k t
handsome	h æ n s ə m
diagram	d aɪ ə ɡ ɹ æ m
cure	k j ʊ ɹ
arrow	æ ɹ oʊ
ultimate	ʌ ɫ t ə m ə t
trick	t ɹ ɪ k
simultaneously	s aɪ m ə ɫ t eɪ n i ə s ɫ i
complaint	k ə m p ɫ eɪ n t
pregnancy	p ɹ ɛ ɡ n ə n s i
enormous	ɪ n ɔ ɹ m ə s
treasure	t ɹ ɛ ʒ ɝ
trauma	t ɹ ɔ m ə
rice	ɹ aɪ s
chart	tʃ ɑ ɹ t
profession	p ɹ ə f ɛ ʃ ə n
assembly	ə s ɛ m b ɫ i
bomb	b ɑ m
declare	d ɪ k ɫ ɛ ɹ
horror	h ɔ ɹ ɝ
naked	n eɪ k ə d
episode	ɛ p ə s oʊ d
appointment	ə p ɔɪ n t m ə n t
ownership	oʊ n ɝ ʃ ɪ p
regulatory	ɹ ɛ ɡ j ə ɫ ə t ɔ ɹ i
removal	ɹ ɪ m u v ə ɫ
roar	ɹ ɔ ɹ
occasionally	ə k eɪ ʒ ə n ə ɫ i
unlike	ə n ɫ aɪ k
clock	k ɫ ɑ k
chin	tʃ ɪ n
tender	t ɛ n d ɝ
constitutional	k ɑ n s t ə t u ʃ ə n ə ɫ
innocent	ɪ n ə s ə n t
nobody	n oʊ b ɑ d i
undertake	ʌ n d ɝ t eɪ k
philosopher	f ə ɫ ɑ s ə f ɝ
temporary	t ɛ m p ɝ ɛ ɹ i
drag	d ɹ æ ɡ
technological	t ɛ k n ə ɫ ɑ dʒ ɪ k ə ɫ
equality	ɪ k w ɑ ɫ ə t i
assistant	ə s ɪ s t ə n t
brow	b ɹ aʊ
partial	p ɑ ɹ ʃ ə ɫ
acceptance	æ k s ɛ p t ə n s
sweat	s w ɛ t
ad	æ d
utter	ʌ t ɝ
settle	s ɛ t ə ɫ
poison	p ɔɪ z ə n
conviction	k ə n v ɪ k ʃ ə n
thread	θ ɹ ɛ d
coverage	k ʌ v ɝ ə dʒ
grey	ɡ ɹ eɪ
lean	ɫ i n
council	k aʊ n s ə ɫ
stimulate	s t ɪ m j ə ɫ eɪ t
mate	m eɪ t
philosophical	f ɪ ɫ ə s ɑ f ɪ k ə ɫ
briefly	b ɹ i f ɫ i
resemble	ɹ ɪ z ɛ m b ə ɫ
coin	k ɔɪ n
min	m ɪ n
queen	k w i n
commit	k ə m ɪ t
publisher	p ʌ b ɫ ɪ ʃ ɝ
compound	k ɑ m p aʊ n d
conservative	k ə n s ɝ v ə t ɪ v
impose	ɪ m p oʊ z
optimal	ɑ p t ə m ə ɫ
upset	ə p s ɛ t
lecture	ɫ ɛ k tʃ ɝ
weapon	w ɛ p ə n
owner	oʊ n ɝ
rope	ɹ oʊ p
abstract	æ b s t ɹ æ k t
waist	w eɪ s t
conversion	k ə n v ɝ ʒ ə n
retain	ɹ ɪ t eɪ n
earn	ɝ n
ex	ɛ k s
devil	d ɛ v ə ɫ
regularly	ɹ ɛ ɡ j ə ɫ ɝ ɫ i
dimensional	d ɪ m ɛ n ʃ ə n ə ɫ
personnel	p ɝ s ə n ɛ ɫ
kick	k ɪ k
violation	v aɪ ə ɫ eɪ ʃ ə n
sail	s eɪ ɫ
thermal	θ ɝ m ə ɫ
occupation	ɑ k j ə p eɪ ʃ ə n
urge	ɝ dʒ
extraordinary	ɛ k s t ɹ ə ɔ ɹ d ə n ɛ ɹ i
painful	p eɪ n f ə ɫ
excess	ɛ k s ɛ s
demon	d i m ə n
organize	ɔ ɹ ɡ ə n aɪ z
parameter	p ɝ æ m ə t ɝ
behave	b ɪ h eɪ v
tightly	t aɪ t ɫ i
moderate	m ɑ d ɝ ə t
agriculture	æ ɡ ɹ ɪ k ʌ ɫ tʃ ɝ
reject	ɹ ɪ dʒ ɛ k t
manuscript	m æ n j ə s k ɹ ɪ p t
agenda	ə dʒ ɛ n d ə
cake	k eɪ k
mile	m aɪ ɫ
approval	ə p ɹ u v ə ɫ
shed	ʃ ɛ d
lip	ɫ ɪ p
firmly	f ɝ m ɫ i
cheap	tʃ i p
diameter	d aɪ æ m ə t ɝ
hungry	h ʌ ŋ ɡ ɹ i
vertical	v ɝ t ɪ k ə ɫ
sensitivity	s ɛ n s ɪ t ɪ v ɪ t i
curriculum	k ɝ ɪ k j ə ɫ ə m
execution	ɛ k s ə k j u ʃ ə n
pin	p ɪ n
applicable	æ p ɫ ə k ə b ə ɫ
drain	d ɹ eɪ n
verb	v ɝ b
stare	s t ɛ ɹ
classic	k ɫ æ s ɪ k
gather	ɡ æ ð ɝ
temporal	t ɛ m p ɝ ə ɫ
lucky	ɫ ʌ k i
tent	t ɛ n t
grief	ɡ ɹ i f
knee	n i
equity	ɛ k w ə t i
competitive	k ə m p ɛ t ə t ɪ v
regardless	ɹ ə ɡ ɑ ɹ d ɫ ə s
interior	ɪ n t ɪ ɹ i ɝ
statistical	s t ə t ɪ s t ɪ k ə ɫ
unity	j u n ə t i
polymer	p ɑ ɫ ə m ɝ
modification	m ɑ d ə f ə k eɪ ʃ ə n
similarity	s ɪ m ə ɫ ɛ ɹ ə t i
museum	m j u z i ə m
opponent	ə p oʊ n ə n t
juice	dʒ u s
attorney	ə t ɝ n i
divorce	d ɪ v ɔ ɹ s
fever	f i v ɝ
collaboration	k ə ɫ æ b ɝ eɪ ʃ ə n
coal	k oʊ ɫ
ideology	aɪ d i ɑ ɫ ə dʒ i
foster	f ɑ s t ɝ
quote	k w oʊ t
arch	ɑ ɹ tʃ
margin	m ɑ ɹ dʒ ə n
blanket	b ɫ æ ŋ k ə t
testimony	t ɛ s t ə m oʊ n i
attract	ə t ɹ æ k t
suspicion	s ə s p ɪ ʃ ə n
empire	ɛ m p aɪ ɝ
regulate	ɹ ɛ ɡ j ə ɫ eɪ t
perceive	p ɝ s i v
enforcement	ɛ n f ɔ ɹ s m ə n t
logical	ɫ ɑ dʒ ɪ k ə ɫ
orange	ɔ ɹ ə n dʒ
immune	ɪ m j u n
critique	k ɹ ə t i k
negotiate	n ə ɡ oʊ ʃ i eɪ t
flag	f ɫ æ ɡ
explicitly	ɪ k s p ɫ ɪ s ə t ɫ i
vulnerable	v ʌ ɫ n ɝ ə b ə ɫ
substitute	s ʌ b s t ə t u t
lend	ɫ ɛ n d
jaw	dʒ ɔ
aesthetic	ɛ s θ ɛ t ɪ k
craft	k ɹ æ f t
assault	ə s ɔ ɫ t
lightly	ɫ aɪ t ɫ i
consult	k ə n s ʌ ɫ t
pregnant	p ɹ ɛ ɡ n ə n t
dragon	d ɹ æ ɡ ə n
alongside	ə ɫ ɔ ŋ s aɪ d
battery	b æ t ɝ i
pity	p ɪ t i
equilibrium	i k w ə ɫ ɪ b ɹ i ə m
differently	d ɪ f ɹ ə n t ɫ i
pro	p ɹ oʊ
fraction	f ɹ æ k ʃ ə n
tune	t u n
terror	t ɛ ɹ ɝ
precious	p ɹ ɛ ʃ ə s
attractive	ə t ɹ æ k t ɪ v
vice	v aɪ s
shield	ʃ i ɫ d
obey	oʊ b eɪ
altogether	ɔ ɫ t ə ɡ ɛ ð ɝ
cloth	k ɫ ɔ θ
destination	d ɛ s t ə n eɪ ʃ ə n
virtual	v ɝ tʃ u ə ɫ
cabin	k æ b ə n
defence	d ɪ f ɛ n s
attain	ə t eɪ n
dramatic	d ɹ ə m æ t ɪ k
besides	b ɪ s aɪ d z
ceremony	s ɛ ɹ ə m oʊ n i
adaptation	æ d ə p t eɪ ʃ ə n
tunnel	t ʌ n ə ɫ
jacket	dʒ æ k ə t
paint	p eɪ n t
asset	æ s ɛ t
exploit	ɛ k s p ɫ ɔɪ t
ceiling	s i ɫ ɪ ŋ
activation	æ k t ə v eɪ ʃ ə n
convention	k ə n v ɛ n ʃ ə n
harvest	h ɑ ɹ v ə s t
castle	k æ s ə ɫ
combat	k ɑ m b æ t
abroad	ə b ɹ ɔ d
pan	p æ n
literally	ɫ ɪ t ɝ ə ɫ i
everybody	ɛ v ɹ i b ɑ d i
neighbor	n eɪ b ɝ
explicit	ɪ k s p ɫ ɪ s ə t
confess	k ə n f ɛ s
incorporate	ɪ n k ɔ ɹ p ɝ eɪ t
readily	ɹ ɛ d ə ɫ i
merchant	m ɝ tʃ ə n t
indication	ɪ n d ə k eɪ ʃ ə n
belt	b ɛ ɫ t
gay	ɡ eɪ
people	p i p ə ɫ
particle	p ɑ ɹ t ə k ə ɫ
persuade	p ɝ s w eɪ d
weekend	w i k ɛ n d
behalf	b ɪ h æ f
funny	f ʌ n i
register	ɹ ɛ dʒ ɪ s t ɝ
lens	ɫ ɛ n z
bet	b ɛ t
holiday	h ɑ ɫ ə d eɪ
eternal	ɪ t ɝ n ə ɫ
adjustment	ə dʒ ʌ s t m ə n t
personally	p ɝ s ə n ə ɫ i
constitution	k ɑ n s t ə t u ʃ ə n
valid	v æ ɫ ɪ d
commander	k ə m æ n d ɝ
identical	aɪ d ɛ n t ɪ k ə ɫ
mercy	m ɝ s i
linguistic	ɫ ɪ ŋ ɡ w ɪ s t ɪ k
electrical	ɪ ɫ ɛ k t ɹ ɪ k ə ɫ
assignment	ə s aɪ n m ə n t
secretary	s ɛ k ɹ ə t ɛ ɹ i
induce	ɪ n d u s
brave	b ɹ eɪ v
guilt	ɡ ɪ ɫ t
reign	ɹ eɪ n
compensation	k ɑ m p ə n s eɪ ʃ ə n
adventure	æ d v ɛ n tʃ ɝ
residence	ɹ ɛ z ɪ d ə n s
composite	k ə m p ɑ z ə t
solar	s oʊ ɫ ɝ
meaningful	m i n ɪ ŋ f ə ɫ
echo	ɛ k oʊ
associate	ə s oʊ s i ə t
patch	p æ tʃ
wrist	ɹ ɪ s t
alter	ɔ ɫ t ɝ
profound	p ɹ oʊ f aʊ n d
intimate	ɪ n t ə m ə t
insist	ɪ n s ɪ s t
tie	t aɪ
pursuit	p ɝ s u t
adoption	ə d ɑ p ʃ ə n
wolf	w ʊ ɫ f
compliance	k ə m p ɫ aɪ ə n s
absent	æ b s ə n t
leather	ɫ ɛ ð ɝ
carrier	k æ ɹ i ɝ
productivity	p ɹ oʊ d ə k t ɪ v ə t i
scent	s ɛ n t
lap	ɫ æ p
adjust	ə dʒ ʌ s t
torture	t ɔ ɹ tʃ ɝ
electricity	ɪ ɫ ɛ k t ɹ ɪ s ə t i
artery	ɑ ɹ t ɝ i
wage	w eɪ dʒ
reliable	ɹ ɪ ɫ aɪ ə b ə ɫ
thumb	θ ʌ m
confident	k ɑ n f ə d ə n t
bitter	b ɪ t ɝ
couch	k aʊ tʃ
tough	t ʌ f
strict	s t ɹ ɪ k t
module	m ɑ dʒ u ɫ
elaborate	ɪ ɫ æ b ɹ ə t
overview	oʊ v ɝ v j u
genuine	dʒ ɛ n j ə w ə n
occurrence	ə k ɝ ə n s
expenditure	ɪ k s p ɛ n d ə tʃ ɝ
contest	k ɑ n t ɛ s t
wrap	ɹ æ p
sentiment	s ɛ n t ə m ə n t
lamp	ɫ æ m p
suicide	s u ə s aɪ d
twin	t w ɪ n
acceptable	æ k s ɛ p t ə b ə ɫ
fabric	f æ b ɹ ɪ k
privacy	p ɹ aɪ v ə s i
fence	f ɛ n s
affection	ə f ɛ k ʃ ə n
conceptual	k ə n s ɛ p tʃ u ə ɫ
justify	dʒ ʌ s t ə f aɪ
ticket	t ɪ k ə t
neutral	n u t ɹ ə ɫ
precise	p ɹ ɪ s aɪ s
recommend	ɹ ɛ k ə m ɛ n d
healthcare	h ɛ ɫ θ k ɛ ɹ
aunt	æ n t
dawn	d ɔ n
blend	b ɫ ɛ n d
cigarette	s ɪ ɡ ɝ ɛ t
proposition	p ɹ ɑ p ə z ɪ ʃ ə n
needle	n i d ə ɫ
minimize	m ɪ n ə m aɪ z
cheese	tʃ i z
artificial	ɑ ɹ t ə f ɪ ʃ ə ɫ
chat	tʃ æ t
apple	æ p ə ɫ
dirty	d ɝ t i
statute	s t æ tʃ u t
unexpected	ʌ n ɪ k s p ɛ k t ɪ d
amongst	ə m ʌ ŋ s t
inclusion	ɪ n k ɫ u ʒ ə n
availability	ə v eɪ ɫ ə b ɪ ɫ ə t i
lifetime	ɫ aɪ f t aɪ m
intend	ɪ n t ɛ n d
hook	h ʊ k
sufficiently	s ə f ɪ ʃ ə n t ɫ i
trans	t ɹ æ n z
ruler	ɹ u ɫ ɝ
horizon	h ɝ aɪ z ə n
stack	s t æ k
imperial	ɪ m p ɪ ɹ i ə ɫ
convert	k ɑ n v ɝ t
punch	p ʌ n tʃ
theatre	θ i ə t ɝ
monster	m ɑ n s t ɝ
promotion	p ɹ ə m oʊ ʃ ə n
default	d ɪ f ɔ ɫ t
alliance	ə ɫ aɪ ə n s
heal	h i ɫ
respective	ɹ ɪ s p ɛ k t ɪ v
hire	h aɪ ɝ
filling	f ɪ ɫ ɪ ŋ
dig	d ɪ ɡ
neural	n ʊ ɹ ə ɫ
slavery	s ɫ eɪ v ɝ i
grandfather	ɡ ɹ æ n d f ɑ ð ɝ
thoroughly	θ ɝ oʊ ɫ i
gut	ɡ ʌ t
sympathy	s ɪ m p ə θ i
theology	θ i ɑ ɫ ə dʒ i
merit	m ɛ ɹ ə t
membership	m ɛ m b ɝ ʃ ɪ p
guest	ɡ ɛ s t
deposit	d ə p ɑ z ɪ t
aircraft	ɛ ɹ k ɹ æ f t
prevention	p ɹ i v ɛ n ʃ ə n
subsequently	s ʌ b s ə k w ə n t ɫ i
mortality	m ɔ ɹ t æ ɫ ə t i
pepper	p ɛ p ɝ
usage	j u s ə dʒ
cope	k oʊ p
desperate	d ɛ s p ɹ ɪ t
egg	ɛ ɡ
container	k ə n t eɪ n ɝ
grandmother	ɡ ɹ æ n d m ʌ ð ɝ
occupy	ɑ k j ə p aɪ
emperor	ɛ m p ɝ ɝ
launch	ɫ ɔ n tʃ
leaf	ɫ i f
elbow	ɛ ɫ b oʊ
facility	f ə s ɪ ɫ ɪ t i
lateral	ɫ æ t ɝ ə ɫ
badly	b æ d ɫ i
impulse	ɪ m p ə ɫ s
expertise	ɛ k s p ɝ t i z
governor	ɡ ʌ v ɝ n ɝ
eastern	i s t ɝ n
integrity	ɪ n t ɛ ɡ ɹ ə t i
internet	ɪ n t ɝ n ɛ t
modeling	m ɑ d ə ɫ ɪ ŋ
enforce	ɛ n f ɔ ɹ s
assert	ə s ɝ t
currency	k ɝ ə n s i
surgical	s ɝ dʒ ɪ k ə ɫ
forbid	f ɝ b ɪ d
unlikely	ə n ɫ aɪ k ɫ i
curtain	k ɝ t ə n
mobility	m oʊ b ɪ ɫ ə t i
departure	d ɪ p ɑ ɹ tʃ ɝ
behavioral	b ɪ h eɪ v j ɝ ə ɫ
therapeutic	θ ɛ ɹ ə p j u t ɪ k
server	s ɝ v ɝ
bench	b ɛ n tʃ
cultivation	k ʌ ɫ t ɪ v eɪ ʃ ə n
mineral	m ɪ n ɝ ə ɫ
breach	b ɹ i tʃ
archive	ɑ ɹ k aɪ v
brilliant	b ɹ ɪ ɫ j ə n t
stake	s t eɪ k
genre	ʒ ɑ n ɹ ə
drama	d ɹ ɑ m ə
integrate	ɪ n t ə ɡ ɹ eɪ t
curiosity	k j ʊ ɹ i ɑ s ə t i
temper	t ɛ m p ɝ
judicial	dʒ u d ɪ ʃ ə ɫ
cattle	k æ t ə ɫ
hierarchy	h aɪ ɝ ɑ ɹ k i
blank	b ɫ æ ŋ k
formulation	f ɔ ɹ m j ə ɫ eɪ ʃ ə n
differential	d ɪ f ɝ ɛ n ʃ ə ɫ
physically	f ɪ z ɪ k ə ɫ i
relax	ɹ ɪ ɫ æ k s
eager	i ɡ ɝ
dignity	d ɪ ɡ n ə t i
prophet	p ɹ ɑ f ə t
attachment	ə t æ tʃ m ə n t
sustain	s ə s t eɪ n
transportation	t ɹ æ n s p ɝ t eɪ ʃ ə n
overlap	oʊ v ɝ ɫ æ p
derivative	d ɝ ɪ v ə t ɪ v
invest	ɪ n v ɛ s t
stimulus	s t ɪ m j ə ɫ ə s
progressive	p ɹ ə ɡ ɹ ɛ s ɪ v
comparative	k ə m p ɛ ɹ ə t ɪ v
surrender	s ɝ ɛ n d ɝ
rhythm	ɹ ɪ ð ə m
affair	ə f ɛ ɹ
freely	f ɹ i ɫ i
manufacture	m æ n j ə f æ k tʃ ɝ
somebody	s ʌ m b ɑ d i
chill	tʃ ɪ ɫ
alert	ə ɫ ɝ t
sole	s oʊ ɫ
bullet	b ʊ ɫ ə t
mathematical	m æ θ ə m æ t ɪ k ə ɫ
paradigm	p ɛ ɹ ə d aɪ m
shout	ʃ aʊ t
widespread	w aɪ d s p ɹ ɛ d
revolutionary	ɹ ɛ v ə ɫ u ʃ ə n ɛ ɹ i
unconscious	ʌ n k ɑ n ʃ ə s
tape	t eɪ p
myth	m ɪ θ
bound	b aʊ n d
metaphor	m ɛ t ə f ɔ ɹ
restore	ɹ ɪ s t ɔ ɹ
illustration	ɪ ɫ ə s t ɹ eɪ ʃ ə n
sheep	ʃ i p
legitimate	ɫ ə dʒ ɪ t ə m ə t
regression	ɹ ə ɡ ɹ ɛ ʃ ə n
ache	eɪ k
snake	s n eɪ k
script	s k ɹ ɪ p t
roughly	ɹ ʌ f ɫ i
span	s p æ n
delicate	d ɛ ɫ ə k ə t
charm	tʃ ɑ ɹ m
indigenous	ɪ n d ɪ dʒ ə n ə s
laser	ɫ eɪ z ɝ
cow	k aʊ
telephone	t ɛ ɫ ə f oʊ n
uncomfortable	ə n k ʌ m f ɝ t ə b ə ɫ
scratch	s k ɹ æ tʃ
audit	ɔ d ɪ t
heritage	h ɛ ɹ ə t ə dʒ
nevertheless	n ɛ v ɝ ð ə ɫ ɛ s
aggregate	æ ɡ ɹ ə ɡ ə t
jury	dʒ ʊ ɹ i
ecosystem	i k oʊ s ɪ s t ə m
skirt	s k ɝ t
mature	m ə tʃ ʊ ɹ
interfere	ɪ n t ɝ f ɪ ɹ
integral	ɪ n t ə ɡ ɹ ə ɫ
trigger	t ɹ ɪ ɡ ɝ
autonomy	ɔ t ɑ n ə m i
robot	ɹ oʊ b ɑ t
grid	ɡ ɹ ɪ d
despair	d ɪ s p ɛ ɹ
infinite	ɪ n f ə n ə t
gear	ɡ ɪ ɹ
plaintiff	p ɫ eɪ n t ə f
midst	m ɪ d s t
sorrow	s ɑ ɹ oʊ
pit	p ɪ t
whip	w ɪ p
hormone	h ɔ ɹ m oʊ n
plasma	p ɫ æ z m ə
objection	ə b dʒ ɛ k ʃ ə n
bath	b æ θ
proceeding	p ɹ ə s i d ɪ ŋ
instinct	ɪ n s t ɪ ŋ k t
bloody	b ɫ ʌ d i
ministry	m ɪ n ə s t ɹ i
thesis	θ i s ə s
practically	p ɹ æ k t ɪ k ɫ i
productive	p ɹ ə d ʌ k t ɪ v
partially	p ɑ ɹ ʃ ə ɫ i
exclude	ɪ k s k ɫ u d
throne	θ ɹ oʊ n
dive	d aɪ v
chip	tʃ ɪ p
halt	h ɔ ɫ t
concentrate	k ɑ n s ə n t ɹ eɪ t
horizontal	h ɔ ɹ ə z ɑ n t ə ɫ
strive	s t ɹ aɪ v
fleet	f ɫ i t
mild	m aɪ ɫ d
nest	n ɛ s t
birthday	b ɝ θ d eɪ
purple	p ɝ p ə ɫ
quantum	k w ɑ n t ə m
rid	ɹ ɪ d
automatically	ɔ t ə m æ t ɪ k ɫ i
mighty	m aɪ t i
derive	d ɝ aɪ v
scarcely	s k ɛ ɹ s ɫ i
bark	b ɑ ɹ k
faithful	f eɪ θ f ə ɫ
sketch	s k ɛ tʃ
patent	p æ t ə n t
thickness	θ ɪ k n ə s
hybrid	h aɪ b ɹ ə d
miracle	m ɪ ɹ ə k ə ɫ
qualitative	k w ɑ ɫ ə t eɪ t ɪ v
cotton	k ɑ t ə n
remedy	ɹ ɛ m ə d i
finite	f aɪ n aɪ t
tense	t ɛ n s
bore	b ɔ ɹ
resort	ɹ ɪ z ɔ ɹ t
anchor	æ ŋ k ɝ
observer	ə b z ɝ v ɝ
flexible	f ɫ ɛ k s ə b ə ɫ
exploration	ɛ k s p ɫ ɝ eɪ ʃ ə n
pole	p oʊ ɫ
spine	s p aɪ n
sip	s ɪ p
quantitative	k w ɑ n t ɪ t eɪ t ɪ v
doorway	d ɔ ɹ w eɪ
seemingly	s i m ɪ ŋ ɫ i
nowhere	n oʊ w ɛ ɹ
shortly	ʃ ɔ ɹ t ɫ i
celebrate	s ɛ ɫ ə b ɹ eɪ t
informal	ɪ n f ɔ ɹ m ə ɫ
beneficial	b ɛ n ə f ɪ ʃ ə ɫ
magnitude	m æ ɡ n ə t u d
trunk	t ɹ ʌ ŋ k
citizen	s ɪ t ə z ə n
disadvantage	d ɪ s ə d v æ n t ɪ dʒ
actively	æ k t ɪ v ɫ i
deviation	d i v i eɪ ʃ ə n
writing	ɹ aɪ t ɪ ŋ
football	f ʊ t b ɔ ɫ
bubble	b ʌ b ə ɫ
actor	æ k t ɝ
brick	b ɹ ɪ k
expose	ɪ k s p oʊ z
therapist	θ ɛ ɹ ə p ə s t
analytical	æ n ə ɫ ɪ t ɪ k ə ɫ
warmth	w ɔ ɹ m θ
invisible	ɪ n v ɪ z ə b ə ɫ
belly	b ɛ ɫ i
corruption	k ɝ ʌ p ʃ ə n
substrate	s ʌ b s t ɹ eɪ t
toy	t ɔɪ
elderly	ɛ ɫ d ɝ ɫ i
mysterious	m ɪ s t ɪ ɹ i ə s
portrait	p ɔ ɹ t ɹ ə t
penalty	p ɛ n ə ɫ t i
economics	ɛ k ə n ɑ m ɪ k s
adverse	æ d v ɝ s
intelligent	ɪ n t ɛ ɫ ə dʒ ə n t
silk	s ɪ ɫ k
strand	s t ɹ æ n d
consensus	k ə n s ɛ n s ə s
dependence	d ɪ p ɛ n d ə n s
conscience	k ɑ n ʃ ə n s
adapt	ə d æ p t
invitation	ɪ n v ɪ t eɪ ʃ ə n
statue	s t æ tʃ u
probe	p ɹ oʊ b
emergence	ɪ m ɝ dʒ ə n s
accomplish	ə k ɑ m p ɫ ɪ ʃ
civilian	s ə v ɪ ɫ j ə n
warrant	w ɔ ɹ ə n t
pig	p ɪ ɡ
fulfill	f ʊ ɫ f ɪ ɫ
subtle	s ʌ t ə ɫ
twist	t w ɪ s t
shiver	ʃ ɪ v ɝ
ton	t ʌ n
hunt	h ʌ n t
sampling	s æ m p ɫ ɪ ŋ
symbolic	s ɪ m b ɑ ɫ ɪ k
controlling	k ə n t ɹ oʊ ɫ ɪ ŋ
commodity	k ə m ɑ d ə t i
wealthy	w ɛ ɫ θ i
sustainability	s ə s t eɪ n ə b ɪ ɫ ɪ t i
genius	dʒ i n j ə s
verify	v ɛ ɹ ə f aɪ
specify	s p ɛ s ə f aɪ
deficiency	d ɪ f ɪ ʃ ə n s i
efficacy	ɛ f ɪ k æ s i
inherent	ɪ n h ɪ ɹ ə n t
maid	m eɪ d
romantic	ɹ oʊ m æ n t ɪ k
protective	p ɹ ə t ɛ k t ɪ v
reception	ɹ ɪ s ɛ p ʃ ə n
invasion	ɪ n v eɪ ʒ ə n
passive	p æ s ɪ v
civilization	s ɪ v ə ɫ ɪ z eɪ ʃ ə n
operational	ɑ p ɝ eɪ ʃ ə n ə ɫ
extraction	ɛ k s t ɹ æ k ʃ ə n
copper	k ɑ p ɝ
oxide	ɑ k s aɪ d
corridor	k ɔ ɹ ə d ɝ
cheer	tʃ ɪ ɹ
awful	ɑ f ə ɫ
undermine	ʌ n d ɝ m aɪ n
metric	m ɛ t ɹ ɪ k
generous	dʒ ɛ n ɝ ə s
repeatedly	ɹ ɪ p i t ɪ d ɫ i
diagnostic	d aɪ ə ɡ n ɑ s t ɪ k
bold	b oʊ ɫ d
excessive	ɪ k s ɛ s ɪ v
tourism	t ʊ ɹ ɪ z ə m
fatigue	f ə t i ɡ
rifle	ɹ aɪ f ə ɫ
absorption	ə b z ɔ ɹ p ʃ ə n
scholarship	s k ɑ ɫ ɝ ʃ ɪ p
correctly	k ɝ ɛ k t ɫ i
entertain	ɛ n t ɝ t eɪ n
injection	ɪ n dʒ ɛ k ʃ ə n
photograph	f oʊ t ə ɡ ɹ æ f
cruel	k ɹ u ə ɫ
terminal	t ɝ m ə n ə ɫ
imply	ɪ m p ɫ aɪ
cord	k ɔ ɹ d
estimation	ɛ s t ə m eɪ ʃ ə n
candle	k æ n d ə ɫ
sofa	s oʊ f ə
optical	ɑ p t ɪ k ə ɫ
ambition	æ m b ɪ ʃ ə n
accessible	æ k s ɛ s ə b ə ɫ
purely	p j ʊ ɹ ɫ i
dull	d ʌ ɫ
complain	k ə m p ɫ eɪ n
competence	k ɑ m p ə t ɪ n s
deficit	d ɛ f ə s ə t
exclusive	ɪ k s k ɫ u s ɪ v
illegal	ɪ ɫ i ɡ ə ɫ
salvation	s æ ɫ v eɪ ʃ ə n
robe	ɹ oʊ b
semi	s ɛ m i
loyalty	ɫ ɔɪ ə ɫ t i
whilst	w aɪ ɫ s t
translate	t ɹ æ n z ɫ eɪ t
peculiar	p ə k j u ɫ j ɝ
solely	s oʊ ə ɫ i
replacement	ɹ ɪ p ɫ eɪ s m ə n t
dense	d ɛ n s
validity	v ə ɫ ɪ d ə t i
similarly	s ɪ m ə ɫ ɝ ɫ i
bush	b ʊ ʃ
hydrogen	h aɪ d ɹ ə dʒ ə n
workshop	w ɝ k ʃ ɑ p
pollution	p ə ɫ u ʃ ə n
submit	s ə b m ɪ t
comply	k ə m p ɫ aɪ
realised	ɹ i ə ɫ aɪ z d
uncertain	ə n s ɝ t ə n
clue	k ɫ u
cough	k ɑ f
funeral	f j u n ɝ ə ɫ
artistic	ɑ ɹ t ɪ s t ɪ k
inevitable	ɪ n ɛ v ə t ə b ə ɫ
bunch	b ʌ n tʃ
donor	d oʊ n ɝ
intermediate	ɪ n t ɝ m i d i ɪ t
signature	s ɪ ɡ n ə tʃ ɝ
feminist	f ɛ m ə n ɪ s t
isolation	aɪ s ə ɫ eɪ ʃ ə n
rival	ɹ aɪ v ə ɫ
static	s t æ t ɪ k
tolerance	t ɑ ɫ ɝ ə n s
purse	p ɝ s
clarify	k ɫ ɛ ɹ ə f aɪ
tract	t ɹ æ k t
anybody	ɛ n i b ə d i
honey	h ʌ n i
fierce	f ɪ ɹ s
chocolate	tʃ ɔ k ɫ ə t
furniture	f ɝ n ɪ tʃ ɝ
scar	s k ɑ ɹ
swallow	s w ɑ ɫ oʊ
revelation	ɹ ɛ v ə ɫ eɪ ʃ ə n
projection	p ɹ ə dʒ ɛ k ʃ ə n
peaceful	p i s f ə ɫ
subjective	s ə b dʒ ɛ k t ɪ v
bay	b eɪ
verbal	v ɝ b ə ɫ
humble	h ʌ m b ə ɫ
utilize	j u t ə ɫ aɪ z
optimization	ɑ p t ə m ə z eɪ ʃ ə n
flour	f ɫ aʊ ɝ
studio	s t u d i oʊ
disgust	d ɪ s ɡ ʌ s t
pussy	p ʊ s i
width	w ɪ d θ
pet	p ɛ t
manual	m æ n j u ə ɫ
penetrate	p ɛ n ə t ɹ eɪ t
dirt	d ɝ t
drill	d ɹ ɪ ɫ
designer	d ɪ z aɪ n ɝ
enthusiasm	ɪ n θ u z i æ z ə m
upstairs	ə p s t ɛ ɹ z
vulnerability	v ʌ ɫ n ɝ ə b ɪ ɫ ɪ t i
likelihood	ɫ aɪ k ɫ i h ʊ d
arrange	ɝ eɪ n dʒ
posterior	p ɔ s t ɪ ɹ j ɝ
safely	s eɪ f ɫ i
campus	k æ m p ə s
diabetes	d aɪ ə b i t i z
marine	m ɝ i n
steer	s t ɪ ɹ
conservation	k ɑ n s ɝ v eɪ ʃ ə n
insult	ɪ n s ʌ ɫ t
menu	m ɛ n j u
spy	s p aɪ
assure	ə ʃ ʊ ɹ
supplement	s ʌ p ɫ ə m ə n t
query	k w i ɹ i
minimal	m ɪ n ə m ə ɫ
salary	s æ ɫ ɝ i
inferior	ɪ n f ɪ ɹ i ɝ
mathematics	m æ θ ə m æ t ɪ k s
weird	w ɪ ɹ d
kindness	k aɪ n d n ə s
meaning	m i n ɪ ŋ
attraction	ə t ɹ æ k ʃ ə n
prize	p ɹ aɪ z
basket	b æ s k ə t
quit	k w ɪ t
prejudice	p ɹ ɛ dʒ ə d ɪ s
sleeve	s ɫ i v
harsh	h ɑ ɹ ʃ
glimpse	ɡ ɫ ɪ m p s
lifestyle	ɫ aɪ f s t aɪ ɫ
alike	ə ɫ aɪ k
valve	v æ ɫ v
indirect	ɪ n d ɝ ɛ k t
literacy	ɫ ɪ t ɝ ə s i
corn	k ɔ ɹ n
screw	s k ɹ u
displacement	d ɪ s p ɫ eɪ s m ə n t
boil	b ɔɪ ɫ
cable	k eɪ b ə ɫ
swing	s w ɪ ŋ
bulk	b ʌ ɫ k
spark	s p ɑ ɹ k
useless	j u s ɫ ə s
justification	dʒ ʌ s t ə f ə k eɪ ʃ ə n
ecological	i k ə ɫ ɑ dʒ ɪ k ə ɫ
handling	h æ n d ɫ ɪ ŋ
copyright	k ɑ p i ɹ aɪ t
keen	k i n
ash	æ ʃ
dollar	d ɑ ɫ ɝ
recipe	ɹ ɛ s ə p i
ideological	aɪ d i ə ɫ ɑ dʒ ɪ k ə ɫ
buyer	b aɪ ɝ
systemic	s ɪ s t ɛ m ɪ k
beloved	b ɪ ɫ ʌ v d
fake	f eɪ k
airport	ɛ ɹ p ɔ ɹ t
reporter	ɹ ɪ p ɔ ɹ t ɝ
breed	b ɹ i d
demonstration	d ɛ m ə n s t ɹ eɪ ʃ ə n
exclusively	ɪ k s k ɫ u s ɪ v ɫ i
hip	h ɪ p
admission	æ d m ɪ ʃ ə n
fantasy	f æ n t ə s i
accommodate	ə k ɑ m ə d eɪ t
capitalism	k æ p ɪ t ə ɫ ɪ z ə m
blast	b ɫ æ s t
developmental	d ɪ v ɛ ɫ ə p m ɛ n t ə ɫ
forest	f ɔ ɹ ə s t
gang	ɡ æ ŋ
variance	v ɛ ɹ i ə n s
prisoner	p ɹ ɪ z ə n ɝ
lease	ɫ i s
vain	v eɪ n
degradation	d ɛ ɡ ɹ ə d eɪ ʃ ə n
inspiration	ɪ n s p ɝ eɪ ʃ ə n
ugly	ʌ ɡ ɫ i
silently	s aɪ ɫ ə n t ɫ i
abandon	ə b æ n d ə n
exam	ɪ ɡ z æ m
inspection	ɪ n s p ɛ k ʃ ə n
inventory	ɪ n v ə n t ɔ ɹ i
endless	ɛ n d ɫ ə s
rail	ɹ eɪ ɫ
patience	p eɪ ʃ ə n s
legislative	ɫ ɛ dʒ ə s ɫ eɪ t ɪ v
reinforce	ɹ i ɪ n f ɔ ɹ s
lightning	ɫ aɪ t n ɪ ŋ
gross	ɡ ɹ oʊ s
rebel	ɹ ɛ b ə ɫ
bolt	b oʊ ɫ t
inter	ɪ n t ɝ
teaspoon	t i s p u n
alien	eɪ ɫ i ə n
concert	k ɑ n s ɝ t
immigration	ɪ m ə ɡ ɹ eɪ ʃ ə n
circular	s ɝ k j ə ɫ ɝ
incidence	ɪ n s ə d ə n s
strictly	s t ɹ ɪ k t ɫ i
loudly	ɫ aʊ d ɫ i
singular	s ɪ ŋ ɡ j ə ɫ ɝ
sovereign	s ɑ v ɹ ə n
reside	ɹ ɪ z aɪ d
surge	s ɝ dʒ
hallway	h ɔ ɫ w eɪ
virtually	v ɝ tʃ u ə ɫ i
influential	ɪ n f ɫ u ɛ n ʃ ə ɫ
lonely	ɫ oʊ n ɫ i
aggressive	ə ɡ ɹ ɛ s ɪ v
trajectory	t ɹ ə dʒ ɛ k t ɝ i
considerably	k ə n s ɪ d ɝ ə b ɫ i
forecast	f ɔ ɹ k æ s t
nucleus	n u k ɫ i ə s
killer	k ɪ ɫ ɝ
spit	s p ɪ t
frustration	f ɹ ə s t ɹ eɪ ʃ ə n
anterior	æ n t ɪ ɹ i ɝ
horn	h ɔ ɹ n
ban	b æ n
dwell	d w ɛ ɫ
void	v ɔɪ d
collar	k ɑ ɫ ɝ
adjacent	ə dʒ eɪ s ə n t
portfolio	p ɔ ɹ t f oʊ ɫ i oʊ
spray	s p ɹ eɪ
gratitude	ɡ ɹ æ t ə t u d
tragedy	t ɹ æ dʒ ə d i
accumulation	ə k j u m j ə ɫ eɪ ʃ ə n
capitalist	k æ p ə t ə ɫ ɪ s t
relevance	ɹ ɛ ɫ ə v ə n s
fry	f ɹ aɪ
diffusion	d ɪ f j u ʒ ə n
inhibit	ɪ n h ɪ b ə t
steep	s t i p
rejection	ɹ ɪ dʒ ɛ k ʃ ə n
workplace	w ɝ k p ɫ eɪ s
inspire	ɪ n s p aɪ ɹ
wholly	h oʊ ɫ i
medieval	m ɪ d i v ə ɫ
legacy	ɫ ɛ ɡ ə s i
damp	d æ m p
hazard	h æ z ɝ d
beard	b ɪ ɹ d
breeze	b ɹ i z
glucose	ɡ ɫ u k oʊ s
triumph	t ɹ aɪ ə m f
interference	ɪ n t ɝ f ɪ ɹ ə n s
swim	s w ɪ m
creativity	k ɹ i eɪ t ɪ v ə t i
gravity	ɡ ɹ æ v ə t i
diamond	d aɪ m ə n d
desirable	d ɪ z aɪ ɹ ə b ə ɫ
founder	f aʊ n d ɝ
blush	b ɫ ʌ ʃ
onset	ɑ n s ɛ t
innovative	ɪ n ə v eɪ t ɪ v
circulation	s ɝ k j ə ɫ eɪ ʃ ə n
railway	ɹ eɪ ɫ w eɪ
correspondence	k ɔ ɹ ə s p ɑ n d ə n s
jail	dʒ eɪ ɫ
broadcast	b ɹ ɔ d k æ s t
olive	ɑ ɫ ə v
sauce	s ɔ s
prompt	p ɹ ɑ m p t
flexibility	f ɫ ɛ k s ə b ɪ ɫ ə t i
dread	d ɹ ɛ d
squeeze	s k w i z
subordinate	s ə b ɔ ɹ d ə n eɪ t
evidently	ɛ v ə d ə n t ɫ i
mud	m ʌ d
modify	m ɑ d ə f aɪ
gonna	ɡ ɑ n ə
reliability	ɹ i ɫ aɪ ə b ɪ ɫ ə t i
electrode	ɪ ɫ ɛ k t ɹ oʊ d
disposition	d ɪ s p ə z ɪ ʃ ə n
dim	d ɪ m
goodness	ɡ ʊ d n ə s
oven	ʌ v ə n
recognised	ɹ ɛ k ə ɡ n aɪ z d
cardiac	k ɑ ɹ d i æ k
tide	t aɪ d
cabinet	k æ b ə n ə t
festival	f ɛ s t ə v ə ɫ
deliberately	d ɪ ɫ ɪ b ɝ ə t ɫ i
harmony	h ɑ ɹ m ə n i
lodge	ɫ ɑ dʒ
pillow	p ɪ ɫ oʊ
ha	h ɑ
continent	k ɑ n t ə n ə n t
satellite	s æ t ə ɫ aɪ t
altar	ɔ ɫ t ɝ
theological	θ i ə ɫ ɑ dʒ ɪ k ə ɫ
illusion	ɪ ɫ u ʒ ə n
obscure	ə b s k j ʊ ɹ
theater	θ i ə t ɝ
backward	b æ k w ɝ d
disclose	d ɪ s k ɫ oʊ z
expectation	ɛ k s p ɛ k t eɪ ʃ ə n
kidney	k ɪ d n i
widow	w ɪ d oʊ
mandate	m æ n d eɪ t
bishop	b ɪ ʃ ə p
disclosure	d ɪ s k ɫ oʊ ʒ ɝ
inflammatory	ɪ n f ɫ æ m ə t ɔ ɹ i
borrow	b ɑ ɹ oʊ
respiratory	ɹ ɛ s p ɝ ə t ɔ ɹ i
publicly	p ʌ b ɫ ɪ k ɫ i
bundle	b ʌ n d ə ɫ
hollow	h ɑ ɫ oʊ
citizenship	s ɪ t ɪ z ə n ʃ ɪ p
fee	f i
wheat	w i t
intervene	ɪ n t ɝ v i n
invention	ɪ n v ɛ n ʃ ə n
exclusion	ɪ k s k ɫ u ʒ ə n
distinctive	d ɪ s t ɪ ŋ k t ɪ v
decay	d ɪ k eɪ
dish	d ɪ ʃ
monk	m ʌ ŋ k
shrink	ʃ ɹ ɪ ŋ k
caution	k ɑ ʃ ə n
mill	m ɪ ɫ
morality	m ɝ æ ɫ ə t i
lion	ɫ aɪ ə n
dual	d u ə ɫ
horrible	h ɔ ɹ ə b ə ɫ
detective	d ɪ t ɛ k t ɪ v
declaration	d ɛ k ɫ ɝ eɪ ʃ ə n
knight	n aɪ t
exile	ɛ ɡ z aɪ ɫ
worldwide	w ɝ ɫ d w aɪ d
entertainment	ɛ n t ɝ t eɪ n m ə n t
recipient	ɹ ə s ɪ p i ə n t
sovereignty	s ɑ v ɹ ə n t i
duck	d ʌ k
sensory	s ɛ n s ɝ i
normative	n ɔ ɹ m ə t ɪ v
comparable	k ɑ m p ɝ ə b ə ɫ
hunger	h ʌ ŋ ɡ ɝ
attribute	æ t ɹ ə b j u t
frown	f ɹ aʊ n
charity	tʃ ɛ ɹ ɪ t i
importantly	ɪ m p ɔ ɹ t ə n t ɫ i
socially	s oʊ ʃ ə ɫ i
realization	ɹ i ɫ ə z eɪ ʃ ə n
reconstruction	ɹ i k ə n s t ɹ ʌ k ʃ ə n
barrel	b æ ɹ ə ɫ
towel	t aʊ ə ɫ
acquaintance	ə k w eɪ n t ə n s
shear	ʃ ɪ ɹ
lad	ɫ æ d
shallow	ʃ æ ɫ oʊ
rotation	ɹ oʊ t eɪ ʃ ə n
neglect	n ə ɡ ɫ ɛ k t
explosion	ɪ k s p ɫ oʊ ʒ ə n
wherever	w ɛ ɹ ɛ v ɝ
completion	k ə m p ɫ i ʃ ə n
cease	s i s
volunteer	v ɑ ɫ ə n t ɪ ɹ
terrorist	t ɛ ɹ ɝ ɪ s t
researcher	ɹ i s ɝ tʃ ɝ
consistently	k ə n s ɪ s t ə n t ɫ i
problematic	p ɹ ɑ b ɫ ə m æ t ɪ k
numerical	n u m ɛ ɹ ə k ə ɫ
upward	ʌ p w ɝ d
bit	b ɪ t
flourish	f ɫ ɝ ɪ ʃ
pad	p æ d
disappointment	d ɪ s ə p ɔɪ n t m ə n t
tag	t æ ɡ
contradiction	k ɑ n t ɹ ə d ɪ k ʃ ə n
robust	ɹ oʊ b ʌ s t
absorb	ə b z ɔ ɹ b
knot	n ɑ t
certainty	s ɝ t ə n t i
certificate	s ɝ t ɪ f ɪ k ə t
allocation	æ ɫ ə k eɪ ʃ ə n
amendment	ə m ɛ n d m ə n t
mount	m aʊ n t
mock	m ɑ k
wipe	w aɪ p
gospel	ɡ ɑ s p ə ɫ
holder	h oʊ ɫ d ɝ
crush	k ɹ ʌ ʃ
coordination	k oʊ ɔ ɹ d ə n eɪ ʃ ə n
renal	ɹ i n ə ɫ
sway	s w eɪ
stamp	s t æ m p
mainstream	m eɪ n s t ɹ i m
corpse	k ɔ ɹ p s
disturbance	d ɪ s t ɝ b ə n s
assertion	ə s ɝ ʃ ə n
bind	b aɪ n d
capability	k eɪ p ə b ɪ ɫ ə t i
intensive	ɪ n t ɛ n s ɪ v
clay	k ɫ eɪ
drum	d ɹ ʌ m
meta	m i t ə
clerk	k ɫ ɝ k
unhappy	ə n h æ p i
accent	ə k s ɛ n t
hatred	h eɪ t ɹ ə d
intake	ɪ n t eɪ k
sharply	ʃ ɑ ɹ p ɫ i
continuously	k ə n t ɪ n j u ə s ɫ i
commerce	k ɑ m ɝ s
jar	dʒ ɑ ɹ
